id,conversation_id,created_at,date,time,timezone,user_id,username,name,place,tweet,language,mentions,urls,photos,replies_count,retweets_count,likes_count,hashtags,cashtags,link,retweet,quote_url,video,thumbnail,near,geo,source,user_rt_id,user_rt,retweet_id,reply_to,retweet_date,translate,trans_src,trans_dest
1287683230695477248,1287619697425256448,2020-07-27 04:36:20 Hora de verano central (México),2020-07-27,04:36:20,-0500,311430228,bobbyclee,Bobby Lee - Ballet: World's EASIEST wallet!,,"By the end of this year 2020, where will #Bitcoin prices end at?",en,[],[],[],2,3,5,['bitcoin'],[],https://twitter.com/bobbyclee/status/1287683230695477248,False,,0,,,,,,,,[],,,,
1287681795685666817,1287681795685666817,2020-07-27 04:30:38 Hora de verano central (México),2020-07-27,04:30:38,-0500,311430228,bobbyclee,Bobby Lee - Ballet: World's EASIEST wallet!,,"Today is special: #Gold has just surpassed $1,940, breaking its ALL-TIME HIGH record of $1,920 set exactly 9 years ago in August 2011. The rally goes on!  Without coincidence #Bitcoin has just broken $10,000! I’m expecting it to march up to its all-time high of $20,000 from 2017.",en,[],[],[],7,18,144,"['gold', 'bitcoin']",[],https://twitter.com/bobbyclee/status/1287681795685666817,False,,0,,,,,,,,[],,,,
1287619697425256448,1287619697425256448,2020-07-27 00:23:53 Hora de verano central (México),2020-07-27,00:23:53,-0500,311430228,bobbyclee,Bobby Lee - Ballet: World's EASIEST wallet!,,"I still stand by this #Bitcoin price prediction tweet from December 2018.  Now that $BTC prices have crossed back over $10,000, we are now primed for the rally to start later this year. Will we end the year at $15k? $20k? or higher?",en,[],[],[],5,26,74,['bitcoin'],['btc'],https://twitter.com/bobbyclee/status/1287619697425256448,False,https://twitter.com/bobbyclee/status/1071100283638280194,0,,,,,,,,[],,,,
1287601653382656002,1287315588625231872,2020-07-26 23:12:11 Hora de verano central (México),2020-07-26,23:12:11,-0500,311430228,bobbyclee,Bobby Lee - Ballet: World's EASIEST wallet!,,"#Gold has just made history, and broke it's all-time high of $1,920.70 set in 2011. Go Gold!",en,[],[],[],0,10,20,['gold'],[],https://twitter.com/bobbyclee/status/1287601653382656002,False,,0,,,,,,,,[],,,,
1287343642768596992,1287314234733289473,2020-07-26 06:06:56 Hora de verano central (México),2020-07-26,06:06:56,-0500,311430228,bobbyclee,Bobby Lee - Ballet: World's EASIEST wallet!,,It's happening! The #Bitcoin rally is FINALLY getting started... Let's hope it's for real this time.,en,[],[],[],3,5,45,['bitcoin'],[],https://twitter.com/bobbyclee/status/1287343642768596992,False,,0,,,,,,,,[],,,,
1287319305474830340,1287315588625231872,2020-07-26 04:30:14 Hora de verano central (México),2020-07-26,04:30:14,-0500,311430228,bobbyclee,Bobby Lee - Ballet: World's EASIEST wallet!,,"Personally, I'm very excited to see Gold prices back up at $1,900+. It's about time! Let's hope it crosses $2,000 soon, and see if it can hit $3,000 by end of this year, Dec 2020.",en,[],[],[],4,5,17,[],[],https://twitter.com/bobbyclee/status/1287319305474830340,False,,0,,,,,,,,[],,,,
1287318629420171264,1287318629420171264,2020-07-26 04:27:33 Hora de verano central (México),2020-07-26,04:27:33,-0500,311430228,bobbyclee,Bobby Lee - Ballet: World's EASIEST wallet!,,"With a global #COVID pandemic this year countries all around the world are introducing economic relief packages by printing money like crazy. Unhinged!  New money mostly still goes to businesses &amp; the #rich, causing a Global Asset Bubble. Look at stocks &amp; real estate. Crazy high!",en,[],[],[],1,2,17,"['covid', 'rich']",[],https://twitter.com/bobbyclee/status/1287318629420171264,False,https://twitter.com/bobbyclee/status/1287314234733289473,0,,,,,,,,[],,,,
1287317527081578496,1287317527081578496,2020-07-26 04:23:10 Hora de verano central (México),2020-07-26,04:23:10,-0500,311430228,bobbyclee,Bobby Lee - Ballet: World's EASIEST wallet!,,"#Defi is arguable the hottest thing in the ""crypto"" industry right now. It's controversial because hardcore #Bitcoin fans are not convinced.  However, we always need a good narrative, and it seems to captivate quite an audience. Is #DecentralizedFinance the next revolution?",en,[],[],[],4,3,19,"['defi', 'bitcoin', 'decentralizedfinance']",[],https://twitter.com/bobbyclee/status/1287317527081578496,False,https://twitter.com/bobbyclee/status/1287314234733289473,0,,,,,,,,[],,,,
1287316003920068609,1287316003920068609,2020-07-26 04:17:07 Hora de verano central (México),2020-07-26,04:17:07,-0500,311430228,bobbyclee,Bobby Lee - Ballet: World's EASIEST wallet!,,"I doubt the next #Bitcoin rally will be based on the same buzzwords as the last rally in 2017: ICOs, Altcoins, Blockchain, etc.  Regardless, I think any asset rally needs a good narrative. What will it be?",en,[],[],[],9,5,31,['bitcoin'],[],https://twitter.com/bobbyclee/status/1287316003920068609,False,https://twitter.com/bobbyclee/status/1287314234733289473,0,,,,,,,,[],,,,
1287315588625231872,1287315588625231872,2020-07-26 04:15:28 Hora de verano central (México),2020-07-26,04:15:28,-0500,311430228,bobbyclee,Bobby Lee - Ballet: World's EASIEST wallet!,,"#Gold has been on a silent rally lately, reaching $1,900, extremely close to the $1,920 ATH from 2011. Once it crosses that, it'll test the all-important $2,000 psychological price point. After, I think it could easily go to $3,000 or even $5,000 / troy ounce. How about #Bitcoin?",en,[],[],[],7,10,49,"['gold', 'bitcoin']",[],https://twitter.com/bobbyclee/status/1287315588625231872,False,https://twitter.com/bobbyclee/status/1287314234733289473,0,,,,,,,,[],,,,
1287314234733289473,1287314234733289473,2020-07-26 04:10:05 Hora de verano central (México),2020-07-26,04:10:05,-0500,311430228,bobbyclee,Bobby Lee - Ballet: World's EASIEST wallet!,,What's going to power the next #Bitcoin rally? (What's the narrative?),en,[],[],[],12,9,21,['bitcoin'],[],https://twitter.com/bobbyclee/status/1287314234733289473,False,,0,,,,,,,,[],,,,
1286092911776395265,1286092911776395265,2020-07-22 19:16:59 Hora de verano central (México),2020-07-22,19:16:59,-0500,311430228,bobbyclee,Bobby Lee - Ballet: World's EASIEST wallet!,,come watch us play live poker!  https://t.co/IEVKXxW9DI,en,[],['https://twitter.com/btcPokerGame/status/1286091961774956545?s=20'],[],0,2,5,[],[],https://twitter.com/bobbyclee/status/1286092911776395265,False,https://twitter.com/btcPokerGame/status/1286091961774956545?s=20,0,,,,,,,,[],,,,
1281380494106456064,1281380494106456064,2020-07-09 19:11:31 Hora de verano central (México),2020-07-09,19:11:31,-0500,311430228,bobbyclee,Bobby Lee - Ballet: World's EASIEST wallet!,,Playing online poker... come watch!  https://t.co/w95U6v5AF3,en,[],['https://twitter.com/btcPokerGame/status/1281378367002914816?s=20'],[],2,3,8,[],[],https://twitter.com/bobbyclee/status/1281380494106456064,False,https://twitter.com/btcPokerGame/status/1281378367002914816?s=20,0,,,,,,,,[],,,,
1280972567352709120,1280972567352709120,2020-07-08 16:10:34 Hora de verano central (México),2020-07-08,16:10:34,-0500,311430228,bobbyclee,Bobby Lee - Ballet: World's EASIEST wallet!,,"@elonmusk I love the new side repeater camera views on the rear camera view.  However, I think @Tesla should switch the placement order, and put the side repeater camera images on top, and the rear view camera on bottom.  Better eye-level view for seeing sides. What do you think?  https://t.co/GWmJNioNkq",en,"[{'screen_name': 'tesla', 'name': 'tesla', 'id': '13298072'}]",[],['https://pbs.twimg.com/media/EcbtwclUYAM70RF.jpg'],3,4,28,[],[],https://twitter.com/bobbyclee/status/1280972567352709120,False,,1,https://pbs.twimg.com/media/EcbtwclUYAM70RF.jpg,,,,,,,[],,,,
1280968690758848512,1280967739910156289,2020-07-08 15:55:09 Hora de verano central (México),2020-07-08,15:55:09,-0500,311430228,bobbyclee,Bobby Lee - Ballet: World's EASIEST wallet!,,"I think it’s ridiculous that governments around the world require ordinary law-abiding citizens to declare the money they carry when traveling across borders. What century are we in?  Don’t criminalize “money laundering” as it’s subjective. Rather, go catch the criminal activity!",en,[],[],[],0,3,13,[],[],https://twitter.com/bobbyclee/status/1280968690758848512,False,,0,,,,,,,,[],,,,
1280967739910156289,1280967739910156289,2020-07-08 15:51:23 Hora de verano central (México),2020-07-08,15:51:23,-0500,311430228,bobbyclee,Bobby Lee - Ballet: World's EASIEST wallet!,,"#Gold has always been legal to own. So why is transporting gold referred to as #smuggling? Why does the law require us to declare gold, when we carry/move these hard earned savings/assets? #FreedomOfMoney  Political row grows over India gold smuggling case  https://t.co/QWUcSMr2nd",en,[],['https://www.bbc.co.uk/news/world-asia-india-53340948'],[],15,9,41,"['gold', 'smuggling', 'freedomofmoney']",[],https://twitter.com/bobbyclee/status/1280967739910156289,False,,0,,,,,,,,[],,,,
1270933213473456129,1270933213473456129,2020-06-10 23:17:45 Hora de verano central (México),2020-06-10,23:17:45,-0500,311430228,bobbyclee,Bobby Lee - Ballet: World's EASIEST wallet!,,"Calling for all #ChainLink supporters: If there’s enough interest, @BalletCrypto will make a custom REAL ChainLink wallet, so that you can easily gift #LINK to your friends &amp; family. A great way for new users to get started with #crypto.  This @kickstarter campaign ends June 25!",en,"[{'screen_name': 'balletcrypto', 'name': 'ballet', 'id': '1153538304580521985'}, {'screen_name': 'kickstarter', 'name': 'kickstarter', 'id': '16186995'}]",[],[],2,5,26,"['chainlink', 'link', 'crypto']",[],https://twitter.com/bobbyclee/status/1270933213473456129,False,https://twitter.com/BalletCrypto/status/1270731984923475970,0,,,,,,,,[],,,,
1270708156000157697,1270708156000157697,2020-06-10 08:23:27 Hora de verano central (México),2020-06-10,08:23:27,-0500,311430228,bobbyclee,Bobby Lee - Ballet: World's EASIEST wallet!,,"Q: Why are stock prices going up when the economy is in ruins?  A: There’s too much money in the system so there’s #AssetInflation, chasing stocks &amp; real estate.  Kind of like the game Musical Chairs &amp; when music stops, people chasing chairs. It’s rigged.  https://t.co/pSv1xKf3xX",en,[],['https://apple.news/AbY-fqAo5Q1qVgUX6zaMraA'],[],3,13,43,['assetinflation'],[],https://twitter.com/bobbyclee/status/1270708156000157697,False,,0,,,,,,,,[],,,,
1268815468879417344,1268815468879417344,2020-06-05 03:02:35 Hora de verano central (México),2020-06-05,03:02:35,-0500,311430228,bobbyclee,Bobby Lee - Ballet: World's EASIEST wallet!,,"What I love about being #American and living in America: #FirstAmendment of our GREAT #Constitution!  Unfortunately, MANY countries don't have this. Can you get these rights if you DEMAND it from your government?  Quick recap of our rights as US citizens:  https://t.co/t5jpnzP6fW",en,[],['https://www.cnn.com/2020/06/02/us/how-to-protest-safely-know-your-rights-wellness-trnd/index.html'],[],3,6,17,"['american', 'firstamendment', 'constitution']",[],https://twitter.com/bobbyclee/status/1268815468879417344,False,,0,,,,,,,,[],,,,
1268591543247503360,1267754615149170688,2020-06-04 12:12:47 Hora de verano central (México),2020-06-04,12:12:47,-0500,311430228,bobbyclee,Bobby Lee - Ballet: World's EASIEST wallet!,,@Bliggawitz @elonmusk @Tesla Ballet wallets. @BalletCrypto,en,"[{'screen_name': 'balletcrypto', 'name': 'ballet', 'id': '1153538304580521985'}]",[],[],1,1,9,[],[],https://twitter.com/bobbyclee/status/1268591543247503360,False,,0,,,,,,,,"[{'screen_name': 'Bliggawitz', 'name': 'Nathan Lebowitz', 'id': '221856093'}, {'screen_name': 'elonmusk', 'name': 'Elon Musk', 'id': '44196397'}, {'screen_name': 'Tesla', 'name': 'Tesla', 'id': '13298072'}]",,,,
1267874337089961985,1267743835083337731,2020-06-02 12:42:52 Hora de verano central (México),2020-06-02,12:42:52,-0500,311430228,bobbyclee,Bobby Lee - Ballet: World's EASIEST wallet!,,"Now that $BTC is back below $10,000, here’s a follow up poll:  Will #Bitcoin price go down below $9,000?   (FYI, I want to buy more at below $8,500 price.)",en,[],[],[],4,5,13,['bitcoin'],['btc'],https://twitter.com/bobbyclee/status/1267874337089961985,False,,0,,,,,,,,[],,,,
1267873689648787456,1267873689648787456,2020-06-02 12:40:18 Hora de verano central (México),2020-06-02,12:40:18,-0500,311430228,bobbyclee,Bobby Lee - Ballet: World's EASIEST wallet!,,"#crowdsourcing wisdom has proven to be correct again!  You all were right; we indeed saw $9,999 again as $BTC price is back below $10,000.",en,[],[],[],0,4,7,['crowdsourcing'],['btc'],https://twitter.com/bobbyclee/status/1267873689648787456,False,https://twitter.com/bobbyclee/status/1267743835083337731,0,,,,,,,,[],,,,
1267766559226773504,1267754615149170688,2020-06-02 05:34:36 Hora de verano central (México),2020-06-02,05:34:36,-0500,311430228,bobbyclee,Bobby Lee - Ballet: World's EASIEST wallet!,,"Will #Bitcoin’s price have exceeded $39,900 by end of 2021?",en,[],[],[],21,45,212,['bitcoin'],[],https://twitter.com/bobbyclee/status/1267766559226773504,False,,0,,,,,,,,[],,,,
1267759301302431745,1267754615149170688,2020-06-02 05:05:45 Hora de verano central (México),2020-06-02,05:05:45,-0500,311430228,bobbyclee,Bobby Lee - Ballet: World's EASIEST wallet!,,"If you believe me about #Bitcoin’s price trajectory next year, you can also buy a @Tesla #CyberTruck for cheap by investing just ~$10,000 now to buy 1 $BTC.",en,"[{'screen_name': 'tesla', 'name': 'tesla', 'id': '13298072'}]",[],[],40,182,758,"['bitcoin', 'cybertruck']",['btc'],https://twitter.com/bobbyclee/status/1267759301302431745,False,,0,,,,,,,,[],,,,
1267754615149170688,1267754615149170688,2020-06-02 04:47:08 Hora de verano central (México),2020-06-02,04:47:08,-0500,311430228,bobbyclee,Bobby Lee - Ballet: World's EASIEST wallet!,,"Hey @elonmusk I’m looking forward to the #CyberTruck next year! By then, I predict you can buy it with just one #Bitcoin. If $BTC price exceeds $39,900 by late 2021, I’ll GIVE AWAY a FREE @Tesla CyberTruck to one lucky person who Likes &amp; Retweets this.  Yes, I’m serious. #Retweet  https://t.co/RcMpcqSPdV",en,"[{'screen_name': 'elonmusk', 'name': 'elon musk', 'id': '44196397'}, {'screen_name': 'tesla', 'name': 'tesla', 'id': '13298072'}]",[],['https://pbs.twimg.com/media/EZf4GI_VcAA6ATV.jpg'],1063,10420,12621,"['cybertruck', 'bitcoin', 'retweet']",['btc'],https://twitter.com/bobbyclee/status/1267754615149170688,False,,1,https://pbs.twimg.com/media/EZf4GI_VcAA6ATV.jpg,,,,,,,[],,,,
1267743835083337731,1267743835083337731,2020-06-02 04:04:18 Hora de verano central (México),2020-06-02,04:04:18,-0500,311430228,bobbyclee,Bobby Lee - Ballet: World's EASIEST wallet!,,"Congrats on #Bitcoin passing USD $10,000 again! Yay.  Is this the last time for $BTC to go up past $10,000? Or will we see it dip below $10k again in the future?",en,[],[],[],8,7,36,['bitcoin'],['btc'],https://twitter.com/bobbyclee/status/1267743835083337731,False,,0,,,,,,,,[],,,,
1264805595959357441,1264661909636182016,2020-05-25 01:28:47 Hora de verano central (México),2020-05-25,01:28:47,-0500,311430228,bobbyclee,Bobby Lee - Ballet: World's EASIEST wallet!,,@RonAway6 @BalletCrypto @kickstarter You can still buy from our company store:  https://t.co/NkFnaztIOr   And you can also sign up to be our reseller:  https://t.co/SzEsXQWd9G,en,[],"['https://store.balletcrypto.com/', 'https://www.balletcrypto.com/reseller/']",[],1,0,0,[],[],https://twitter.com/bobbyclee/status/1264805595959357441,False,,0,,,,,,,,"[{'screen_name': 'RonAway6', 'name': 'Ron DKG', 'id': '1197030962229432321'}, {'screen_name': 'BalletCrypto', 'name': 'Ballet', 'id': '1153538304580521985'}, {'screen_name': 'kickstarter', 'name': 'Kickstarter', 'id': '16186995'}]",,,,
1264661909636182016,1264661909636182016,2020-05-24 15:57:50 Hora de verano central (México),2020-05-24,15:57:50,-0500,311430228,bobbyclee,Bobby Lee - Ballet: World's EASIEST wallet!,,"If you missed the @kickstarter for pre-orders, you still have a chance at getting the lowest serial numbers of the #Stealth REAL Pizza wallet via this auction (ending in 2 hours, at 4:00 pm USA Pacific time):  https://t.co/YS3GMAFbwP",en,"[{'screen_name': 'kickstarter', 'name': 'kickstarter', 'id': '16186995'}]",['https://bitcointalk.org/index.php?topic=5249731.60'],[],2,8,19,['stealth'],[],https://twitter.com/bobbyclee/status/1264661909636182016,False,https://twitter.com/bobbyclee/status/1262895710653071361,0,,,,,,,,[],,,,
1264103101998350337,1263711895170633729,2020-05-23 02:57:20 Hora de verano central (México),2020-05-23,02:57:20,-0500,311430228,bobbyclee,Bobby Lee - Ballet: World's EASIEST wallet!,,"@sreniaw @YourBTCC @BalletCrypto Ballet was still in stealth mode in May 2019, and we didn’t get to celebrate #BitcoinPozzaDay last year.",en,[],[],[],0,0,1,['bitcoinpozzaday'],[],https://twitter.com/bobbyclee/status/1264103101998350337,False,,0,,,,,,,,"[{'screen_name': 'sreniaw', 'name': 'sreniaw', 'id': '68336313'}, {'screen_name': 'YourBTCC', 'name': 'BTCC', 'id': '2338229497'}, {'screen_name': 'BalletCrypto', 'name': 'Ballet', 'id': '1153538304580521985'}]",,,,
1264102932431036417,1263711895170633729,2020-05-23 02:56:39 Hora de verano central (México),2020-05-23,02:56:39,-0500,311430228,bobbyclee,Bobby Lee - Ballet: World's EASIEST wallet!,,@Me2018c @YourBTCC @BalletCrypto My current @BalletCrypto company already has an official R&amp;D office in #Shanghai. We have great talent there; all very experienced people.,en,"[{'screen_name': 'balletcrypto', 'name': 'ballet', 'id': '1153538304580521985'}]",[],[],0,0,0,['shanghai'],[],https://twitter.com/bobbyclee/status/1264102932431036417,False,,0,,,,,,,,"[{'screen_name': 'Me2018c', 'name': 'RatRace-FREE Soon! GLOBAL ADOPTION', 'id': '955807966120169472'}, {'screen_name': 'YourBTCC', 'name': 'BTCC', 'id': '2338229497'}, {'screen_name': 'BalletCrypto', 'name': 'Ballet', 'id': '1153538304580521985'}]",,,,
1264102721142972416,1263711895170633729,2020-05-23 02:55:49 Hora de verano central (México),2020-05-23,02:55:49,-0500,311430228,bobbyclee,Bobby Lee - Ballet: World's EASIEST wallet!,,"@chabudot @YourBTCC @BalletCrypto In 2016, it was actually 2 BTC that we paid, for all the pizza to feed our entire BTCC office for lunch. Yes, the pizza restaurant was paid in fiat, but our company paid BTC to exchange into fiat to pay for the lunch.",en,[],[],[],0,0,0,[],[],https://twitter.com/bobbyclee/status/1264102721142972416,False,,0,,,,,,,,"[{'screen_name': 'chabudot', 'name': 'chab', 'id': '321713660'}, {'screen_name': 'YourBTCC', 'name': 'BTCC', 'id': '2338229497'}, {'screen_name': 'BalletCrypto', 'name': 'Ballet', 'id': '1153538304580521985'}]",,,,
1263909941477126145,1263711895170633729,2020-05-22 14:09:47 Hora de verano central (México),2020-05-22,14:09:47,-0500,311430228,bobbyclee,Bobby Lee - Ballet: World's EASIEST wallet!,,"When measured against the price of 2 pizzas, #Bitcoin has appreciated some 4 MILLION times in value in the last 10 years.  How much will $BTC appreciate in value in the next 10 years?",en,[],[],[],3,4,15,['bitcoin'],['btc'],https://twitter.com/bobbyclee/status/1263909941477126145,False,,0,,,,,,,,[],,,,
1263908756988915712,1263711895170633729,2020-05-22 14:05:04 Hora de verano central (México),2020-05-22,14:05:04,-0500,311430228,bobbyclee,Bobby Lee - Ballet: World's EASIEST wallet!,,@EditorParkin Yes,und,[],[],[],1,0,1,[],[],https://twitter.com/bobbyclee/status/1263908756988915712,False,,0,,,,,,,,"[{'screen_name': 'EditorParkin', 'name': 'Darren Parkin', 'id': '1044218542453854208'}]",,,,
1263907473066389514,1263711895170633729,2020-05-22 13:59:58 Hora de verano central (México),2020-05-22,13:59:58,-0500,311430228,bobbyclee,Bobby Lee - Ballet: World's EASIEST wallet!,,"Here’s the original  https://t.co/vKAnDN9Sqw thread where Laszlo Hanyecz offered to spend 10,000 BTC for 2 #pizzas:  https://t.co/TnAVzPpCLl  10 years later, it’s worth some $92 million. Either #Bitcoin has really appreciated or @PapaJohns pizza🍕has really depreciated in value!😂",en,"[{'screen_name': 'papajohns', 'name': ""papa john's pizza"", 'id': '18450106'}]","['http://BitcoinTalk.org', 'https://bitcointalk.org/index.php?topic=137.0']",[],1,2,8,"['pizzas', 'bitcoin']",[],https://twitter.com/bobbyclee/status/1263907473066389514,False,,0,,,,,,,,[],,,,
1263905040919441408,1263711895170633729,2020-05-22 13:50:18 Hora de verano central (México),2020-05-22,13:50:18,-0500,311430228,bobbyclee,Bobby Lee - Ballet: World's EASIEST wallet!,,"To celebrate #BitcoinPizzaDay, we launched the new #Stealth wallet called REAL Pizza.  It has no references to #Bitcoin or #crypto, so this #BearerAsset won’t draw unnecessary attention from casual observers. (It has native #Segwit bech32 address on front!) Just $69 for 2 wallets  https://t.co/j5sEuArKR2",en,[],[],['https://pbs.twimg.com/media/EYpK71sVAAAf34V.jpg'],2,2,5,"['bitcoinpizzaday', 'stealth', 'bitcoin', 'crypto', 'bearerasset', 'segwit']",[],https://twitter.com/bobbyclee/status/1263905040919441408,False,,1,https://pbs.twimg.com/media/EYpK71sVAAAf34V.jpg,,,,,,,[],,,,
1263903096696004608,1263711895170633729,2020-05-22 13:42:35 Hora de verano central (México),2020-05-22,13:42:35,-0500,311430228,bobbyclee,Bobby Lee - Ballet: World's EASIEST wallet!,,"We celebrated #BitcoinPizzaDay at our @BalletCrypto offices in #LasVegas &amp; #Shanghai today, and had @PapaJohns pizza🍕for lunch. This year, 2020, it only cost 0.0279 BTC! It’s getting less &amp; less expensive. (Can you believe we spent 2 BTC in 2016!!!)  Happy 10th anniversary!  https://t.co/S0ooJb2Rep",en,"[{'screen_name': 'balletcrypto', 'name': 'ballet', 'id': '1153538304580521985'}, {'screen_name': 'papajohns', 'name': ""papa john's pizza"", 'id': '18450106'}]",[],"['https://pbs.twimg.com/media/EYpJJgSUYAEB4cw.jpg', 'https://pbs.twimg.com/media/EYpJJgQUYAIpnHg.jpg', 'https://pbs.twimg.com/media/EYpJJgSVcAAVxA_.jpg', 'https://pbs.twimg.com/media/EYpJJhBUMAAVsU2.jpg']",4,6,18,"['bitcoinpizzaday', 'lasvegas', 'shanghai']",[],https://twitter.com/bobbyclee/status/1263903096696004608,False,,1,https://pbs.twimg.com/media/EYpJJgSUYAEB4cw.jpg,,,,,,,[],,,,
1263751867613339648,1263751867613339648,2020-05-22 03:41:39 Hora de verano central (México),2020-05-22,03:41:39,-0500,311430228,bobbyclee,Bobby Lee - Ballet: World's EASIEST wallet!,,Latest batch of custom-made @BalletCrypto #ProSeries wallets have all been manufactured by our own team in #Shanghai. It’ll ship out from our China office today. Make sure you remember your custom #BIP38 passphrase! Wallets (3 identical copies) are all LOCKED to YOUR passphrase!  https://t.co/ia8h9AXXb1,en,"[{'screen_name': 'balletcrypto', 'name': 'ballet', 'id': '1153538304580521985'}]",[],['https://pbs.twimg.com/media/EYm_n_jVAAA_FCs.jpg'],8,11,38,"['proseries', 'shanghai', 'bip38']",[],https://twitter.com/bobbyclee/status/1263751867613339648,False,,1,https://pbs.twimg.com/media/EYm_n_jVAAA_FCs.jpg,,,,,,,[],,,,
1263711895170633729,1263711895170633729,2020-05-22 01:02:49 Hora de verano central (México),2020-05-22,01:02:49,-0500,311430228,bobbyclee,Bobby Lee - Ballet: World's EASIEST wallet!,,"In 2016, we spent 2.0 BTC to buy pizza for everyone at @YourBTCC on #BitcoinPizzaDay ₿🍕. In 2017, it was 0.412 BTC. In 2018, it was 0.086 BTC.  And now at @BalletCrypto, let’s see how much our company pizza 🍕 lunch will be... Probably a lot less! Tell you all tomorrow.",en,"[{'screen_name': 'yourbtcc', 'name': 'btcc', 'id': '2338229497'}, {'screen_name': 'balletcrypto', 'name': 'ballet', 'id': '1153538304580521985'}]",[],[],5,16,103,['bitcoinpizzaday'],[],https://twitter.com/bobbyclee/status/1263711895170633729,False,https://twitter.com/YourBTCC/status/734646995697184768,0,,,,,,,,[],,,,
1263708202010468354,1263708202010468354,2020-05-22 00:48:08 Hora de verano central (México),2020-05-22,00:48:08,-0500,311430228,bobbyclee,Bobby Lee - Ballet: World's EASIEST wallet!,,"Just ~1 hr left tonight, for you to pre-order on @kickstarter &amp; get delivery from our 1st production batch! It’s the STEALTH wallet, with NO references to #Bitcoin or #crypto. Just a “REAL Pizza🍕” card.  Very limited quantities left. Once product launches, it’ll be back-ordered!",en,"[{'screen_name': 'kickstarter', 'name': 'kickstarter', 'id': '16186995'}]",[],[],0,6,11,"['bitcoin', 'crypto']",[],https://twitter.com/bobbyclee/status/1263708202010468354,False,https://twitter.com/BalletCrypto/status/1263619955724963840,0,,,,,,,,[],,,,
1262895710653071361,1260435329439408128,2020-05-19 18:59:35 Hora de verano central (México),2020-05-19,18:59:35,-0500,311430228,bobbyclee,Bobby Lee - Ballet: World's EASIEST wallet!,,"Here are some preview photos of the REAL Pizza wallet and custom packaging. Official launch will be on #BitcoinPizzaDay this week, on Friday, May 22. Stay tuned!  https://t.co/gZgmov2wjg",en,[],[],"['https://pbs.twimg.com/media/EYa08-sXQAAEQ_h.jpg', 'https://pbs.twimg.com/media/EYa08-tWoAE-Mvb.jpg', 'https://pbs.twimg.com/media/EYa08-rWoAMvfpb.jpg', 'https://pbs.twimg.com/media/EYa08-sWkAEwoUc.jpg']",1,4,12,['bitcoinpizzaday'],[],https://twitter.com/bobbyclee/status/1262895710653071361,False,,1,https://pbs.twimg.com/media/EYa08-sXQAAEQ_h.jpg,,,,,,,[],,,,
1262895044480000001,1262895044480000001,2020-05-19 18:56:56 Hora de verano central (México),2020-05-19,18:56:56,-0500,311430228,bobbyclee,Bobby Lee - Ballet: World's EASIEST wallet!,,"Pre-order your REAL Pizza🍕“stealth” wallet from Kickstarter. Get 2 for just $69.  Celebrate the amazing 10-year anniversary for #BitcoinPizzaDay, and by carrying this REAL Pizza in your leather wallet, no one will know you’re HODLing #Bitcoin and #crypto!  Complete stealth in 🍕",en,[],[],[],2,3,11,"['bitcoinpizzaday', 'bitcoin', 'crypto']",[],https://twitter.com/bobbyclee/status/1262895044480000001,False,https://twitter.com/bobbyclee/status/1262652349392154625,0,,,,,,,,[],,,,
