id,conversation_id,created_at,date,time,timezone,user_id,username,name,place,tweet,language,mentions,urls,photos,replies_count,retweets_count,likes_count,hashtags,cashtags,link,retweet,quote_url,video,thumbnail,near,geo,source,user_rt_id,user_rt,retweet_id,reply_to,retweet_date,translate,trans_src,trans_dest
1306520562424934403,1306518470859735040,2020-09-17 04:09:10 Hora de verano central (México),2020-09-17,04:09:10,-0500,311430228,bobbyclee,Bobby Lee - Ballet: World's EASIEST wallet!,,"Do you personally know of anyone who has lost #Bitcoin or crypto due to misuse of a hardware wallet, mistake in the recovery seed backup process, or other preventable user error?  Let's find out if this is a real problem out there. Please #Retweet!",en,[],[],[],7,8,8,"['bitcoin', 'retweet']",[],https://twitter.com/bobbyclee/status/1306520562424934403,False,,0,,,,,,,,[],,,,
1306518470859735040,1306518470859735040,2020-09-17 04:00:52 Hora de verano central (México),2020-09-17,04:00:52,-0500,311430228,bobbyclee,Bobby Lee - Ballet: World's EASIEST wallet!,,"Crypto wallets: Be aware that security always comes w/ technology hurdles. Higher security increases requirement for users tech sophistication. For most people, there is real downside to using overly secure wallet: Overwhelming &amp; causes misuse &amp; loss of funds through user error.",en,[],[],[],7,7,24,[],[],https://twitter.com/bobbyclee/status/1306518470859735040,False,,0,,,,,,,,[],,,,
1305062479907627013,1305062479907627013,2020-09-13 03:35:16 Hora de verano central (México),2020-09-13,03:35:16,-0500,311430228,bobbyclee,Bobby Lee - Ballet: World's EASIEST wallet!,,This is a very important topic.  Bravo to #Portland for the strictest ban on #FacialRecognition technology. More cities and states should follow! This is essential for true freedom and liberty.  https://t.co/RVr0Goa2Et,en,[],['https://apple.news/A-j9lX33wQO-BZwzZDxOjqA'],[],1,4,14,"['portland', 'facialrecognition']",[],https://twitter.com/bobbyclee/status/1305062479907627013,False,,0,,,,,,,,[],,,,
1304638385525460992,1304638385525460992,2020-09-11 23:30:04 Hora de verano central (México),2020-09-11,23:30:04,-0500,311430228,bobbyclee,Bobby Lee - Ballet: World's EASIEST wallet!,,Great news for Bitcoin! It’s simple:  Record deficit —&gt; Massive money printing —&gt; Soaring prices —&gt; Bitcoin goes all-time high.   US budget deficit soars to $3tn record  https://t.co/TvsAxgBUkO,en,[],['https://www.bbc.co.uk/news/business-54126226'],[],2,14,61,[],[],https://twitter.com/bobbyclee/status/1304638385525460992,False,,0,,,,,,,,[],,,,
1301468773501693955,1301468773501693955,2020-09-03 05:35:10 Hora de verano central (México),2020-09-03,05:35:10,-0500,311430228,bobbyclee,Bobby Lee - Ballet: World's EASIEST wallet!,,"Crazy stupid UI by software engineers &amp; UI designers who just suck &amp; don't care! For something as DANGEROUS as interrupting a firmware update, you would HOPE the UI would give you a CLEAR choice on what to do, and what the severe consequences are? So is it OK or Cancel? #HPfail  https://t.co/ewbhcFu9oT",en,[],[],['https://pbs.twimg.com/media/Eg-9z5kVoAAmJMy.jpg'],5,1,11,['hpfail'],[],https://twitter.com/bobbyclee/status/1301468773501693955,False,,1,https://pbs.twimg.com/media/Eg-9z5kVoAAmJMy.jpg,,,,,,,[],,,,
1299187735521976320,1299187735521976320,2020-08-27 22:31:08 Hora de verano central (México),2020-08-27,22:31:08,-0500,311430228,bobbyclee,Bobby Lee - Ballet: World's EASIEST wallet!,,"If a newbie asks you why #Bitcoin is a great investment, show them this.  https://t.co/MpP7x3GQuY",en,[],['https://apple.news/Ar3QXnmafRl-Wu7qaXrRxKg'],[],1,16,39,['bitcoin'],[],https://twitter.com/bobbyclee/status/1299187735521976320,False,,0,,,,,,,,[],,,,
1297786007232761856,1297669404428308482,2020-08-24 01:41:10 Hora de verano central (México),2020-08-24,01:41:10,-0500,311430228,bobbyclee,Bobby Lee - Ballet: World's EASIEST wallet!,,"@TuurDemeester @barrysilbert I won't mind the @IMF claiming credit for inventing crypto! In fact, I don't mind anyone claiming credit...",en,"[{'screen_name': 'imf', 'name': 'ian mcfarland', 'id': '1260941'}]",[],[],2,0,8,[],[],https://twitter.com/bobbyclee/status/1297786007232761856,False,,0,,,,,,,,"[{'screen_name': 'TuurDemeester', 'name': 'Tuur Demeester', 'id': '40742821'}, {'screen_name': 'BarrySilbert', 'name': 'Barry Silbert', 'id': '396045469'}]",,,,
1296608974628773889,1296608974628773889,2020-08-20 19:44:04 Hora de verano central (México),2020-08-20,19:44:04,-0500,311430228,bobbyclee,Bobby Lee - Ballet: World's EASIEST wallet!,,weekly #crypto #poker game:  https://t.co/PFAwob32Wu,en,[],['https://twitter.com/btcPokerGame/status/1296602898244091910?s=20'],[],2,1,9,"['crypto', 'poker']",[],https://twitter.com/bobbyclee/status/1296608974628773889,False,https://twitter.com/btcPokerGame/status/1296602898244091910?s=20,0,,,,,,,,[],,,,
1295588958408028164,1295588958408028164,2020-08-18 00:10:53 Hora de verano central (México),2020-08-18,00:10:53,-0500,311430228,bobbyclee,Bobby Lee - Ballet: World's EASIEST wallet!,,"#Bitcoin  prices just crossed over USD $12,000 again! It’s happened before, but this time it feels different.  Read my blog post on my current $BTC price prediction, and why prices matter for Bitcoin. Yes, prices do matter!  https://t.co/aHsywAafJp",en,[],['https://www.bobbylee.com/blogs/news/bitcoin-price-predictions-and-why-prices-matter'],[],4,27,92,['bitcoin'],['btc'],https://twitter.com/bobbyclee/status/1295588958408028164,False,,0,,,,,,,,[],,,,
1295586118092517376,1295585743436300289,2020-08-17 23:59:36 Hora de verano central (México),2020-08-17,23:59:36,-0500,311430228,bobbyclee,Bobby Lee - Ballet: World's EASIEST wallet!,,Here’s a shot of the back. A shout out to @BalletCrypto!  https://t.co/LtdM63wwjo,en,"[{'screen_name': 'balletcrypto', 'name': 'ballet', 'id': '1153538304580521985'}]",[],['https://pbs.twimg.com/media/EfrYst1UwAECmNG.jpg'],1,0,18,[],[],https://twitter.com/bobbyclee/status/1295586118092517376,False,,1,https://pbs.twimg.com/media/EfrYst1UwAECmNG.jpg,,,,,,,[],,,,
1295585743436300289,1295585743436300289,2020-08-17 23:58:06 Hora de verano central (México),2020-08-17,23:58:06,-0500,311430228,bobbyclee,Bobby Lee - Ballet: World's EASIEST wallet!,,"We drove our new #ModelY under a rainbow yesterday, and it came out like this! @elonmusk Will your new @Tesla gigafactories have cool paint colors like this? 😄😄😄  https://t.co/FcIt2GEIbS",en,"[{'screen_name': 'elonmusk', 'name': 'elon musk', 'id': '44196397'}, {'screen_name': 'tesla', 'name': 'tesla', 'id': '13298072'}]",[],['https://pbs.twimg.com/media/EfrYWBVVoAACKfN.jpg'],10,5,92,['modely'],[],https://twitter.com/bobbyclee/status/1295585743436300289,False,,1,https://pbs.twimg.com/media/EfrYWBVVoAACKfN.jpg,,,,,,,[],,,,
1294153471525031936,1294153471525031936,2020-08-14 01:06:46 Hora de verano central (México),2020-08-14,01:06:46,-0500,311430228,bobbyclee,Bobby Lee - Ballet: World's EASIEST wallet!,,"Exactly! Too many people fall into the trap thinking that their crypto wallet is trust-less just because it's made from audited or open source hardware, and running open source software.  It's NOT trust-less!  Nothing in the physical world is trust-less! #NothingIsTrustless",en,[],[],[],4,4,17,['nothingistrustless'],[],https://twitter.com/bobbyclee/status/1294153471525031936,False,https://twitter.com/eric_lombrozo/status/1294029338312978432,0,,,,,,,,[],,,,
1294069732140675073,1294069732140675073,2020-08-13 19:34:01 Hora de verano central (México),2020-08-13,19:34:01,-0500,311430228,bobbyclee,Bobby Lee - Ballet: World's EASIEST wallet!,,my weekly poker game:  https://t.co/BVUkyKXNRs,en,[],['https://twitter.com/btcPokerGame/status/1294068536181063680?s=20'],[],0,2,6,[],[],https://twitter.com/bobbyclee/status/1294069732140675073,False,https://twitter.com/btcPokerGame/status/1294068536181063680?s=20,0,,,,,,,,[],,,,
1293120837701124096,1293120837701124096,2020-08-11 04:43:27 Hora de verano central (México),2020-08-11,04:43:27,-0500,311430228,bobbyclee,Bobby Lee - Ballet: World's EASIEST wallet!,,My recent chat about #Bitcoin with business school friends.  https://t.co/dLvje4ziHi,en,[],[],['https://pbs.twimg.com/media/EfIWit0UYAIQW0L.jpg'],10,7,39,['bitcoin'],[],https://twitter.com/bobbyclee/status/1293120837701124096,False,,1,https://pbs.twimg.com/media/EfIWit0UYAIQW0L.jpg,,,,,,,[],,,,
1292758329777745920,1292758329777745920,2020-08-10 04:42:58 Hora de verano central (México),2020-08-10,04:42:58,-0500,311430228,bobbyclee,Bobby Lee - Ballet: World's EASIEST wallet!,,"Not a bad price prediction from February 2017! On that day, #Bitcoin price was only $1,165.  And my price prediction for 2020 post-halving was USD $5,000 to $11,000. And we're at just about $11,900 now.",en,[],[],[],6,9,55,['bitcoin'],[],https://twitter.com/bobbyclee/status/1292758329777745920,False,https://twitter.com/bobbyclee/status/835875006731034624,0,,,,,,,,[],,,,
1292756887574740992,1292756887574740992,2020-08-10 04:37:14 Hora de verano central (México),2020-08-10,04:37:14,-0500,311430228,bobbyclee,Bobby Lee - Ballet: World's EASIEST wallet!,,"I'm writing my next blog entry... (read it later this week.)  Here's an excerpt: ""The 21 million limit is a core design of #Bitcoin, and the corollary is that price volatility and continued upward price cycles are therefore also core features of Bitcoin.""   https://t.co/mCHcMXx8aB",en,[],['https://www.bobbylee.com/blogs/news'],[],2,4,19,['bitcoin'],[],https://twitter.com/bobbyclee/status/1292756887574740992,False,,0,,,,,,,,[],,,,
1292750137211551744,1292748601819426818,2020-08-10 04:10:25 Hora de verano central (México),2020-08-10,04:10:25,-0500,311430228,bobbyclee,Bobby Lee - Ballet: World's EASIEST wallet!,,What's the current price of #Bitcoin (in US dollars)?  (Note the comparison to the price of #Gold above),en,[],[],[],0,3,9,"['bitcoin', 'gold']",[],https://twitter.com/bobbyclee/status/1292750137211551744,False,,0,,,,,,,,[],,,,
1292748601819426818,1292748601819426818,2020-08-10 04:04:19 Hora de verano central (México),2020-08-10,04:04:19,-0500,311430228,bobbyclee,Bobby Lee - Ballet: World's EASIEST wallet!,,What's an approximation of the current price of #Gold (in US dollars)?  Let's see how many of you actually get this right.,en,[],[],[],8,6,11,['gold'],[],https://twitter.com/bobbyclee/status/1292748601819426818,False,,0,,,,,,,,[],,,,
1292369281485742080,1292367400566890496,2020-08-09 02:57:02 Hora de verano central (México),2020-08-09,02:57:02,-0500,311430228,bobbyclee,Bobby Lee - Ballet: World's EASIEST wallet!,,"I think Cash is one form of money, and it's what we spend day-to-day for goods &amp; services. Whereas Money is broader, and is both the accumulation of and the measurement of one's past earnings.  Such that ""earned money"" that isn't spent should hold its value and be in investments.",en,[],[],[],0,0,13,[],[],https://twitter.com/bobbyclee/status/1292369281485742080,False,,0,,,,,,,,[],,,,
1292367400566890496,1292367400566890496,2020-08-09 02:49:33 Hora de verano central (México),2020-08-09,02:49:33,-0500,311430228,bobbyclee,Bobby Lee - Ballet: World's EASIEST wallet!,,"Conceptually, is Money different from Cash?",en,[],[],[],6,1,20,[],[],https://twitter.com/bobbyclee/status/1292367400566890496,False,,0,,,,,,,,[],,,,
1292328174567608320,1292328174567608320,2020-08-09 00:13:41 Hora de verano central (México),2020-08-09,00:13:41,-0500,311430228,bobbyclee,Bobby Lee - Ballet: World's EASIEST wallet!,,Sad to see so many people lose their Crypto &amp; #Bitcoin by forgetting passwords. Why? People never seem to understand that human memory is fallible! (That's why we engineered @BalletCrypto to NOT depend on memorizing passwords &amp; PINs)  Unlock encrypted ZIP:  https://t.co/b6lS6zZIMP,en,"[{'screen_name': 'balletcrypto', 'name': 'ballet', 'id': '1153538304580521985'}]",['https://www.wired.com/story/quest-to-liberate-bitcoin-from-old-zip-file/'],[],1,7,29,['bitcoin'],[],https://twitter.com/bobbyclee/status/1292328174567608320,False,,0,,,,,,,,[],,,,
1292323381237264385,1292323381237264385,2020-08-08 23:54:38 Hora de verano central (México),2020-08-08,23:54:38,-0500,311430228,bobbyclee,Bobby Lee - Ballet: World's EASIEST wallet!,,"This is how bad our $USD is.... in the last 100 years, the dollar has lost 99% of its value agains #Gold. For real!  So who says inflation doesn't hurt?   https://t.co/1pKZbxDZxQ",en,[],['https://www.zerohedge.com/markets/us-dollar-devalues-99-vs-gold-100-years-gold-price-crosses-2067'],[],2,13,41,['gold'],['usd'],https://twitter.com/bobbyclee/status/1292323381237264385,False,,0,,,,,,,,[],,,,
1291672395850244098,1291672395850244098,2020-08-07 04:47:51 Hora de verano central (México),2020-08-07,04:47:51,-0500,311430228,bobbyclee,Bobby Lee - Ballet: World's EASIEST wallet!,,"Back in 2013, people were incredulous that $BTC prices could exceed #Gold’s price (per oz.) What if I told them one day, #Bitcoin prices would exceed Gold by $10,000? Impossible? Yet here we are in 2020.  And one day, Bitcoin prices will exceed Gold by $100,000. Yes.",en,[],[],[],5,11,85,"['gold', 'bitcoin']",['btc'],https://twitter.com/bobbyclee/status/1291672395850244098,False,,0,,,,,,,,[],,,,
1291659262452576257,1291658631113371648,2020-08-07 03:55:40 Hora de verano central (México),2020-08-07,03:55:40,-0500,311430228,bobbyclee,Bobby Lee - Ballet: World's EASIEST wallet!,,"When more and more people around the world realize that this is achievable AND alread in place (in the form of #Bitcoin), then they will surely all flock over to this fundamental philosophy about money, and become a HODLer and supporter.",en,[],[],[],4,4,16,['bitcoin'],[],https://twitter.com/bobbyclee/status/1291659262452576257,False,,0,,,,,,,,[],,,,
1291658631113371648,1291658631113371648,2020-08-07 03:53:10 Hora de verano central (México),2020-08-07,03:53:10,-0500,311430228,bobbyclee,Bobby Lee - Ballet: World's EASIEST wallet!,,"I think #Bitcoin’s biggest strength is not necessarily in its software developers or market capitalization, but rather that all its supporters share this SAME fundamental belief:  #Money should NOT be centrally managed &amp; controlled, and issuance SHOULD be limited. #FreedomOfMoney",en,[],[],[],9,23,138,"['bitcoin', 'money', 'freedomofmoney']",[],https://twitter.com/bobbyclee/status/1291658631113371648,False,,0,,,,,,,,[],,,,
1291629800184877058,1291607767216619521,2020-08-07 01:58:36 Hora de verano central (México),2020-08-07,01:58:36,-0500,311430228,bobbyclee,Bobby Lee - Ballet: World's EASIEST wallet!,,"@mrnonel Our wallet private keys are 2-factor, as in there are 2 components: (1) encrypted private key and (2) decryption passphrase. This is all non-proprietary &amp; Open Standard, implementing #BIP38. So for 1 of these, we put on sticker, and for the other 1, we laser-etch onto steel card.",en,[],[],[],0,0,1,['bip38'],[],https://twitter.com/bobbyclee/status/1291629800184877058,False,,0,,,,,,,,"[{'screen_name': 'mrnonel', 'name': 'Mark Nakata', 'id': '20319989'}]",,,,
1291607767216619521,1291607767216619521,2020-08-07 00:31:03 Hora de verano central (México),2020-08-07,00:31:03,-0500,311430228,bobbyclee,Bobby Lee - Ballet: World's EASIEST wallet!,,Here are my thoughts on #trust... Should you trust Ballet? Should you trust anyone?  https://t.co/awv68biX7z  Read it on my new  https://t.co/9ko83Peaa1 blog!,en,[],"['https://www.bobbylee.com/blogs/news/should-you-trust-ballet-should-you-trust-anyone', 'http://bobbylee.com']",[],3,8,29,['trust'],[],https://twitter.com/bobbyclee/status/1291607767216619521,False,,0,,,,,,,,[],,,,
1291531519136133120,1291531519136133120,2020-08-06 19:28:04 Hora de verano central (México),2020-08-06,19:28:04,-0500,311430228,bobbyclee,Bobby Lee - Ballet: World's EASIEST wallet!,,"my weekly @btcPokerGame poker game, playing live now. Follow and watch:  https://t.co/XCMrJuzOM6",en,"[{'screen_name': 'btcpokergame', 'name': 'crypto after dark', 'id': '1256270354051407873'}]",['https://twitter.com/btcPokerGame/status/1291529144438669312?s=20'],[],0,2,8,[],[],https://twitter.com/bobbyclee/status/1291531519136133120,False,https://twitter.com/btcPokerGame/status/1291529144438669312?s=20,0,,,,,,,,[],,,,
1289055457521238017,1289055457521238017,2020-07-30 23:29:05 Hora de verano central (México),2020-07-30,23:29:05,-0500,311430228,bobbyclee,Bobby Lee - Ballet: World's EASIEST wallet!,,"Over $21,000 in bounty to hack my two @BalletCrypto wallets: #takebobbysbitcoin 1) I show you the encrypted private key; you guess the passphrase! 2) I show you the BIP38 passphrase, you find the private key.  https://t.co/K1AqgBlmCi",en,"[{'screen_name': 'balletcrypto', 'name': 'ballet', 'id': '1153538304580521985'}]",['https://www.bobbylee.com/blogs/news/21-000-to-hack-ballet-wallets'],[],15,8,29,['takebobbysbitcoin'],[],https://twitter.com/bobbyclee/status/1289055457521238017,False,,0,,,,,,,,[],,,,
1289052234236350466,1289052234236350466,2020-07-30 23:16:16 Hora de verano central (México),2020-07-30,23:16:16,-0500,311430228,bobbyclee,Bobby Lee - Ballet: World's EASIEST wallet!,,"#takebobbysbitcoin Here's a site that explains the hacking contest for my two @BalletCrypto wallets. There's 1.0 BTC stored on each wallet, for you to try and hack. Total bounty is over USD $21,000!  https://t.co/QheDYPVF4G",en,"[{'screen_name': 'balletcrypto', 'name': 'ballet', 'id': '1153538304580521985'}]",['https://takebobbysbitcoin.com'],[],0,6,17,['takebobbysbitcoin'],[],https://twitter.com/bobbyclee/status/1289052234236350466,False,,0,,,,,,,,[],,,,
1289043100959039488,1289004702122643456,2020-07-30 22:39:59 Hora de verano central (México),2020-07-30,22:39:59,-0500,311430228,bobbyclee,Bobby Lee - Ballet: World's EASIEST wallet!,,"#BIP38 standard allows you to cryptographic verify the generated encrypted private key, so that you know your passphrase can decrypt.  Here’s the BIP38 confirmation code for this wallet, available in app: cfrm38VUh2i5qzzCqedWtc8ekFxT3UpcQnfb42JRrLbTWCRTfgVTCXqLp3FYxqiyQDo4D3DyWzY",en,[],[],[],1,2,11,['bip38'],[],https://twitter.com/bobbyclee/status/1289043100959039488,False,,0,,,,,,,,[],,,,
1289016909195689984,1289004702122643456,2020-07-30 20:55:54 Hora de verano central (México),2020-07-30,20:55:54,-0500,311430228,bobbyclee,Bobby Lee - Ballet: World's EASIEST wallet!,,Looks like it's taken!,en,[],[],[],1,1,9,[],[],https://twitter.com/bobbyclee/status/1289016909195689984,False,,0,,,,,,,,[],,,,
1289011807160397824,1289004702122643456,2020-07-30 20:35:38 Hora de verano central (México),2020-07-30,20:35:38,-0500,311430228,bobbyclee,Bobby Lee - Ballet: World's EASIEST wallet!,,"To get you started, here are both parts of the 2-factor private key for an actual Ballet wallet.   0.0011 BTC *FREE* to you, if you take it soon. You can use @BalletCrypto mobile app:  https://t.co/yVdEG25xYf  https://t.co/pjkITffdh1",en,"[{'screen_name': 'balletcrypto', 'name': 'ballet', 'id': '1153538304580521985'}]",['https://app.balletcrypto.com/'],['https://pbs.twimg.com/media/EeN9ZyNUMAAeVdC.jpg'],4,3,14,[],[],https://twitter.com/bobbyclee/status/1289011807160397824,False,,1,https://pbs.twimg.com/media/EeN9ZyNUMAAeVdC.jpg,,,,,,,[],,,,
1289007284979302400,1289004702122643456,2020-07-30 20:17:39 Hora de verano central (México),2020-07-30,20:17:39,-0500,311430228,bobbyclee,Bobby Lee - Ballet: World's EASIEST wallet!,,"I revealed these encrypted private keys &amp; passphrase on live video, during our @btcPokerGame poker game. Here are the players on our #CryptoAfterDark poker table today: @SatoshiLite @PeterMcCormack @VentureCoinist @SpadaforaChris @AriDavidPaul @namdar @EdwardAMoncada @stonegtv",en,"[{'screen_name': 'btcpokergame', 'name': 'crypto after dark', 'id': '1256270354051407873'}, {'screen_name': 'satoshilite', 'name': 'charlie lee [ltc⚡]', 'id': '14338147'}, {'screen_name': 'petermccormack', 'name': 'peter mccormack', 'id': '893818632089763840'}, {'screen_name': 'venturecoinist', 'name': 'luke martin', 'id': '877728873340956672'}, {'screen_name': 'aridavidpaul', 'name': 'ari paul ⛓️', 'id': '847882255540342784'}, {'screen_name': 'namdar', 'name': 'david j. namdar', 'id': '18421065'}, {'screen_name': 'edwardamoncada', 'name': 'edward moncada', 'id': '322257836'}, {'screen_name': 'stonegtv', 'name': 'jason stone', 'id': '4495232063'}]",[],[],5,1,8,['cryptoafterdark'],[],https://twitter.com/bobbyclee/status/1289007284979302400,False,,0,,,,,,,,[],,,,
1289004707499741185,1289004702122643456,2020-07-30 20:07:25 Hora de verano central (México),2020-07-30,20:07:25,-0500,311430228,bobbyclee,Bobby Lee - Ballet: World's EASIEST wallet!,,"The 2nd wallet, I will reveal the scratch-off area, giving you the full BIP38 passphrase: 594Y-L2RW-4ME7-2XVX-9B41 Also 1.0 BTC on this wallet. You can verify using @BalletCrypto mobile app w/ this BTC deposit address: 1QGtbKxx6FKDD66LwnrzHCAHmyZ7mDHqC4  Total bounty over $21,000  https://t.co/WsiQxSK3Vw",en,"[{'screen_name': 'balletcrypto', 'name': 'ballet', 'id': '1153538304580521985'}]",[],['https://pbs.twimg.com/media/EeNzYosU8AIj1h6.jpg'],2,8,27,[],[],https://twitter.com/bobbyclee/status/1289004707499741185,False,,1,https://pbs.twimg.com/media/EeNzYosU8AIj1h6.jpg,,,,,,,[],,,,
1289004704886743041,1289004702122643456,2020-07-30 20:07:24 Hora de verano central (México),2020-07-30,20:07:24,-0500,311430228,bobbyclee,Bobby Lee - Ballet: World's EASIEST wallet!,,"Here you go! Try to hack my wallet, the encrypted private key is: 6PnQmAyBky9ZXJyZBv9QSGRUXkKh9HfnVsZWPn4YtcwoKy5vufUgfA3Ld7  It's got 1.0 BTC stored on it, which you can verify using the @BalletCrypto mobile app. The BTC deposit address is: 1JxWyNrkgYvgsHu8hVQZqTXEB9RftRGP5m  https://t.co/BnEulgGuEc",en,"[{'screen_name': 'balletcrypto', 'name': 'ballet', 'id': '1153538304580521985'}]",[],['https://pbs.twimg.com/media/EeNyXh-UwAAToEr.jpg'],2,5,19,[],[],https://twitter.com/bobbyclee/status/1289004704886743041,False,,1,https://pbs.twimg.com/media/EeNyXh-UwAAToEr.jpg,,,,,,,[],,,,
1289004702122643456,1289004702122643456,2020-07-30 20:07:24 Hora de verano central (México),2020-07-30,20:07:24,-0500,311430228,bobbyclee,Bobby Lee - Ballet: World's EASIEST wallet!,,"In celebration of @BalletCrypto achieving USD $21 Million in total wallet deposits, I'm putting out a bounty of $21,000 to let you hack my 2 Ballet wallets, each w/ 1.0 BTC stored on them. Here's the first wallet; I will pull off the sticker, and reveal the Encrypted Private Key.  https://t.co/M6bFOKbYZF",en,"[{'screen_name': 'balletcrypto', 'name': 'ballet', 'id': '1153538304580521985'}]",[],['https://pbs.twimg.com/media/EeNwTlWU8AAYeMl.jpg'],14,26,77,[],[],https://twitter.com/bobbyclee/status/1289004702122643456,False,,1,https://pbs.twimg.com/media/EeNwTlWU8AAYeMl.jpg,,,,,,,[],,,,
1288993237835735042,1288993237835735042,2020-07-30 19:21:50 Hora de verano central (México),2020-07-30,19:21:50,-0500,311430228,bobbyclee,Bobby Lee - Ballet: World's EASIEST wallet!,,"Playing live online poker, come watch:  https://t.co/A8cTVwxlxf",en,[],['https://twitter.com/btcPokerGame/status/1288991433450352640?s=20'],[],0,1,9,[],[],https://twitter.com/bobbyclee/status/1288993237835735042,False,https://twitter.com/btcPokerGame/status/1288991433450352640?s=20,0,,,,,,,,[],,,,
1288691178351673345,1288688431405518848,2020-07-29 23:21:34 Hora de verano central (México),2020-07-29,23:21:34,-0500,311430228,bobbyclee,Bobby Lee - Ballet: World's EASIEST wallet!,,"To celebrate this $21 million @BalletCrypto milestone, I'm offering special deals on Ballet products on my new  https://t.co/9ko83Peaa1 blog site... for one week only!  https://t.co/ucQf7Au74k",en,"[{'screen_name': 'balletcrypto', 'name': 'ballet', 'id': '1153538304580521985'}]","['http://bobbylee.com', 'https://bobbylee.com/collections/all']",[],0,3,9,[],[],https://twitter.com/bobbyclee/status/1288691178351673345,False,,0,,,,,,,,[],,,,
1288690033545736192,1288690033545736192,2020-07-29 23:17:01 Hora de verano central (México),2020-07-29,23:17:01,-0500,311430228,bobbyclee,Bobby Lee - Ballet: World's EASIEST wallet!,,"I just launched my new personal blog &amp; website:  https://t.co/9ko83Peaa1 Here's my first post, where I talk about @BalletCrypto, why I started this wallet company, and what's so special about our recent company milestone of $21 million in customer deposits:  https://t.co/Qg0uhcJDCs",en,"[{'screen_name': 'balletcrypto', 'name': 'ballet', 'id': '1153538304580521985'}]","['http://bobbylee.com', 'https://bobbylee.com/blogs/news/21-million-in-ballet-customer-trust']",[],2,3,15,[],[],https://twitter.com/bobbyclee/status/1288690033545736192,False,,0,,,,,,,,[],,,,
1288688431405518848,1288688431405518848,2020-07-29 23:10:39 Hora de verano central (México),2020-07-29,23:10:39,-0500,311430228,bobbyclee,Bobby Lee - Ballet: World's EASIEST wallet!,,I've got great news to share:  1) @BalletCrypto just announced that we've reached $21 million USD in customer deposits. That's $21 million in cryptocurrency TRUSTING Ballet's product &amp; technologies.  2) I just launched my new personal blog &amp; website:  https://t.co/9ko83Peaa1,en,"[{'screen_name': 'balletcrypto', 'name': 'ballet', 'id': '1153538304580521985'}]",['http://bobbylee.com'],[],21,8,31,[],[],https://twitter.com/bobbyclee/status/1288688431405518848,False,https://twitter.com/BalletCrypto/status/1288682645757390849,0,,,,,,,,[],,,,
1287798690200002563,1287798690200002563,2020-07-27 12:15:08 Hora de verano central (México),2020-07-27,12:15:08,-0500,311430228,bobbyclee,Bobby Lee - Ballet: World's EASIEST wallet!,,"Almost 3 years later, and still true today...",en,[],[],[],0,6,43,[],[],https://twitter.com/bobbyclee/status/1287798690200002563,False,https://twitter.com/bobbyclee/status/914721510568345600,0,,,,,,,,[],,,,
