id,conversation_id,created_at,date,time,timezone,user_id,username,name,place,tweet,language,mentions,urls,photos,replies_count,retweets_count,likes_count,hashtags,cashtags,link,retweet,quote_url,video,thumbnail,near,geo,source,user_rt_id,user_rt,retweet_id,reply_to,retweet_date,translate,trans_src,trans_dest
1343943564162703360,1343939897305034752,2020-12-29 09:34:49 Hora estándar central (México),2020-12-29,09:34:49,-0500,311430228,bobbyclee,Bobby Lee - Ballet: World's EASIEST wallet!,,"Since #Bitcoin can’t be squashed and can’t die, it just roared back stronger than ever, culminating in its bull market peak at the end of 2017.   I predict the same (amazing) fate for Bitcoin in 2021, with a massive bull market rally, taking its ATH up another order of magnitude.",en,[],[],[],2,4,31,['bitcoin'],[],https://twitter.com/bobbyclee/status/1343943564162703360,False,,0,,,,,,,,[],,,,
1343942928935354368,1343939897305034752,2020-12-29 09:32:18 Hora estándar central (México),2020-12-29,09:32:18,-0500,311430228,bobbyclee,Bobby Lee - Ballet: World's EASIEST wallet!,,"China got started in Jan 2017 (PBOC) when they came knocking on doors of exchanges. Follow up conversations in the Spring &amp; Summer, culminating on Sep 4.  USA got a head start in Oct 2020 (SEC, DOJ) against BitMEX, and now Ripple/XRP. More in 2021 (CFTC, FinCEN, Treasury, IRS).",en,[],[],[],1,2,17,[],[],https://twitter.com/bobbyclee/status/1343942928935354368,False,,0,,,,,,,,[],,,,
1343939897305034752,1343939897305034752,2020-12-29 09:20:15 Hora estándar central (México),2020-12-29,09:20:15,-0500,311430228,bobbyclee,Bobby Lee - Ballet: World's EASIEST wallet!,,The 2017 bull market year was marked by regulatory action in China (overt and covert) throughout that year. The 2021 bull market year will be marked by regulatory action in the USA. Buckle up! This is just the beginning... (Bring out the popcorn?) #Bitcoin,en,[],[],[],7,8,42,['bitcoin'],[],https://twitter.com/bobbyclee/status/1343939897305034752,False,,0,,,,,,,,[],,,,
1343926055946641409,1343926055946641409,2020-12-29 08:25:15 Hora estándar central (México),2020-12-29,08:25:15,-0500,311430228,bobbyclee,Bobby Lee - Ballet: World's EASIEST wallet!,,Newbie: what’s the definition of PoS coins?,en,[],[],[],9,1,10,[],[],https://twitter.com/bobbyclee/status/1343926055946641409,False,,0,,,,,,,,[],,,,
1343230949543305216,1343230949543305216,2020-12-27 10:23:09 Hora estándar central (México),2020-12-27,10:23:09,-0500,311430228,bobbyclee,Bobby Lee - Ballet: World's EASIEST wallet!,,"Five months ago, I put up this challenge to the crypto community to try and hack two @BalletCrypto wallets, each loaded with ONE #BITCOIN on it. A total bounty of 2.0 $BTC. Now the prize is worth over $55,000, and still up for grabs! See if you can break the #BIP38 encryption.",en,"[{'screen_name': 'balletcrypto', 'name': 'ballet', 'id': '1153538304580521985'}]",[],[],6,5,27,"['bitcoin', 'bip38']",['btc'],https://twitter.com/bobbyclee/status/1343230949543305216,False,https://twitter.com/bobbyclee/status/1289004702122643456,0,,,,,,,,[],,,,
1343108754594820097,1343108754594820097,2020-12-27 02:17:35 Hora estándar central (México),2020-12-27,02:17:35,-0500,311430228,bobbyclee,Bobby Lee - Ballet: World's EASIEST wallet!,,"That’s not me.  That’s a fake account on @instagram pretending to be me. Please don’t fall for it. (I think it’s peddling some investment schemes...)  Anyone know high level management at Instagram, to help take down this fake account? I’ve asked multiple times, to no avail.",en,"[{'screen_name': 'instagram', 'name': 'instagram', 'id': '180505807'}]",[],[],5,4,18,[],[],https://twitter.com/bobbyclee/status/1343108754594820097,False,https://twitter.com/HowardAStewart/status/1342907298906320896,0,,,,,,,,[],,,,
1342891602617004034,1342891602617004034,2020-12-26 11:54:42 Hora estándar central (México),2020-12-26,11:54:42,-0500,311430228,bobbyclee,Bobby Lee - Ballet: World's EASIEST wallet!,,"On this 10th day of #Bitcoin’s bull market (since December 16), the price has already gone up ~30%, almost reaching $26,000 today.   Will $BTC cross $30k by end of this year?",en,[],[],[],4,4,16,['bitcoin'],['btc'],https://twitter.com/bobbyclee/status/1342891602617004034,False,,0,,,,,,,,[],,,,
1342877330155458561,1342877330155458561,2020-12-26 10:57:59 Hora estándar central (México),2020-12-26,10:57:59,-0500,311430228,bobbyclee,Bobby Lee - Ballet: World's EASIEST wallet!,,Looks like some whale (or institution?) is buying up #Bitcoin during this quiet holiday weekend?  https://t.co/1wwwMQ2NY0,en,[],[],['https://pbs.twimg.com/media/EqLbzQdXUAAgML-.jpg'],16,15,105,['bitcoin'],[],https://twitter.com/bobbyclee/status/1342877330155458561,False,,1,https://pbs.twimg.com/media/EqLbzQdXUAAgML-.jpg,,,,,,,[],,,,
1342684788877000704,1342684788877000704,2020-12-25 22:12:54 Hora estándar central (México),2020-12-25,22:12:54,-0500,311430228,bobbyclee,Bobby Lee - Ballet: World's EASIEST wallet!,,"If you’re in Shanghai this week, please come join me for this talk on Wednesday evening, December 30: Gold, US Dollar, and #Bitcoin: the Evolution of Money.  https://t.co/SUZoGMkJ5z",en,[],[],['https://pbs.twimg.com/media/EqIssbHUYAEedif.jpg'],4,5,22,['bitcoin'],[],https://twitter.com/bobbyclee/status/1342684788877000704,False,,1,https://pbs.twimg.com/media/EqIssbHUYAEedif.jpg,,,,,,,[],,,,
1342683758869147648,1342683758869147648,2020-12-25 22:08:48 Hora estándar central (México),2020-12-25,22:08:48,-0500,311430228,bobbyclee,Bobby Lee - Ballet: World's EASIEST wallet!,,"#Bitcoin has just reached a new All-Time High of $25,000! Amazing.  Let’s HODL to the moon!  https://t.co/5LuXqZHLLC",en,[],[],['https://pbs.twimg.com/media/EqIrwiFUwAE91av.jpg'],7,4,76,['bitcoin'],[],https://twitter.com/bobbyclee/status/1342683758869147648,False,,1,https://pbs.twimg.com/media/EqIrwiFUwAE91av.jpg,,,,,,,[],,,,
1340169946735779840,1339478216331980800,2020-12-18 23:39:49 Hora estándar central (México),2020-12-18,23:39:49,-0500,311430228,bobbyclee,Bobby Lee - Ballet: World's EASIEST wallet!,,@mikeinspace @JUSTINSUN @adam3us @PeterSchiff @stevenmnuchin1 @Free_Ross @LukeDashjr @melikmanukyan @brian_armstrong @elonmusk @La__Cuen @pete_rizzo_ Thanks for your support Mike! Merry Christmas to you and your family.,en,[],[],[],0,0,4,[],[],https://twitter.com/bobbyclee/status/1340169946735779840,False,,0,,,,,,,,"[{'screen_name': 'mikeinspace', 'name': 'miguel en el espacio 🇸🇻', 'id': '49321996'}, {'screen_name': 'JUSTINSUN', 'name': 'Benigna', 'id': '27632802'}, {'screen_name': 'adam3us', 'name': 'Adam Back', 'id': '213236426'}, {'screen_name': 'PeterSchiff', 'name': 'Peter Schiff', 'id': '56562803'}, {'screen_name': 'stevenmnuchin1', 'name': 'Steven Mnuchin', 'id': '799764016885329921'}, {'screen_name': 'Free_Ross', 'name': 'Free_Ross', 'id': '2161821500'}, {'screen_name': 'LukeDashjr', 'name': 'Luke Dashjr', 'id': '728747154'}, {'screen_name': 'melikmanukyan', 'name': 'Donald J. Trump', 'id': '919078970192048128'}, {'screen_name': 'brian_armstrong', 'name': 'Brian Armstrong', 'id': '14379660'}, {'screen_name': 'elonmusk', 'name': 'Elon Musk', 'id': '44196397'}, {'screen_name': 'La__Cuen', 'name': 'Leigh Cuen', 'id': '416161639'}, {'screen_name': 'pete_rizzo_', 'name': 'RIZZO', 'id': '341746855'}]",,,,
1339209661149573121,1339209661149573121,2020-12-16 08:03:59 Hora estándar central (México),2020-12-16,08:03:59,-0500,311430228,bobbyclee,Bobby Lee - Ballet: World's EASIEST wallet!,,"Finally! #Bitcoin over $20,000! To the moon and beyond!!!!!!  https://t.co/75tM9Fx7sS",en,[],[],['https://pbs.twimg.com/media/EpXUE0aW8AACIRu.jpg'],2,20,181,['bitcoin'],[],https://twitter.com/bobbyclee/status/1339209661149573121,False,,1,https://pbs.twimg.com/media/EpXUE0aW8AACIRu.jpg,,,,,,,[],,,,
1339207179639910402,1339207179639910402,2020-12-16 07:54:07 Hora estándar central (México),2020-12-16,07:54:07,-0500,311430228,bobbyclee,Bobby Lee - Ballet: World's EASIEST wallet!,,"#Bitcoin  has finally crossed $20,000! Congratulations to all the HODLers.  Now the #bullmarket has really started!  https://t.co/clNSkjO19W",en,[],[],['https://pbs.twimg.com/media/EpXR0Y9XcAEDENb.jpg'],5,14,112,"['bitcoin', 'bullmarket']",[],https://twitter.com/bobbyclee/status/1339207179639910402,False,,1,https://pbs.twimg.com/media/EpXR0Y9XcAEDENb.jpg,,,,,,,[],,,,
1339205931553320961,1339205931553320961,2020-12-16 07:49:09 Hora estándar central (México),2020-12-16,07:49:09,-0500,311430228,bobbyclee,Bobby Lee - Ballet: World's EASIEST wallet!,,"#Bitcoin has finally crossed $20,000! Congratulations to all the HODLers.  Now the #bullmarket has really started!",en,[],[],[],7,17,153,"['bitcoin', 'bullmarket']",[],https://twitter.com/bobbyclee/status/1339205931553320961,False,,0,,,,,,,,[],,,,
1337079989028573184,1337079989028573184,2020-12-10 11:01:25 Hora estándar central (México),2020-12-10,11:01:25,-0500,311430228,bobbyclee,Bobby Lee - Ballet: World's EASIEST wallet!,,Prediction: You will have tremendous success introducing #Bitcoin to your pre-coiner friends and family if you give them a Ballet REAL Series wallet.    https://t.co/DVsi5mkNxL  https://t.co/0XdYjHmoEL,en,[],['https://store.balletcrypto.com/collections/ballet/products/new-year-gift-set'],['https://pbs.twimg.com/media/Eo5BxpCVEAA4yyW.jpg'],5,5,29,['bitcoin'],[],https://twitter.com/bobbyclee/status/1337079989028573184,False,,1,https://pbs.twimg.com/media/Eo5BxpCVEAA4yyW.jpg,,,,,,,[],,,,
1336150840420265984,1336144762353618948,2020-12-07 21:29:19 Hora estándar central (México),2020-12-07,21:29:19,-0500,311430228,bobbyclee,Bobby Lee - Ballet: World's EASIEST wallet!,,"Can #Bitcoin mining grow 56x in the next 15 years, to reach $1 billion USD in daily production costs?  If so, then that can justify a $19 million Bitcoin price because by the end of 2035, the daily new supply will just be 56 BTC. At the $19mn price, it’s $1 billion dollars daily.",en,[],[],[],2,1,25,['bitcoin'],[],https://twitter.com/bobbyclee/status/1336150840420265984,False,,0,,,,,,,,[],,,,
1336150837882736643,1336144762353618948,2020-12-07 21:29:18 Hora estándar central (México),2020-12-07,21:29:18,-0500,311430228,bobbyclee,Bobby Lee - Ballet: World's EASIEST wallet!,,"With 6.25 BTC block rewards today, that’s a supply of 900 new BTC per day, valued at ~$18 million USD. This is the upper limit of the world’s daily investment into #Bitcoin mining: hardware costs &amp; depreciation and electricity.",en,[],[],[],1,1,15,['bitcoin'],[],https://twitter.com/bobbyclee/status/1336150837882736643,False,,0,,,,,,,,[],,,,
1336150835420680201,1336144762353618948,2020-12-07 21:29:18 Hora estándar central (México),2020-12-07,21:29:18,-0500,311430228,bobbyclee,Bobby Lee - Ballet: World's EASIEST wallet!,,"Over the last 12 years of #Bitcoin, we had 3 block halvings, with block rewards starting at 50 BTC in 2009 and coming down to just 6.25 BTC per block today.  In the next 15 years, we will have 4 block halvings, bringing the block reward to just 0.39 BTC by end of 2035. Minuscule!",en,[],[],[],1,2,15,['bitcoin'],[],https://twitter.com/bobbyclee/status/1336150835420680201,False,,0,,,,,,,,[],,,,
1336146813070487555,1336144762353618948,2020-12-07 21:13:19 Hora estándar central (México),2020-12-07,21:13:19,-0500,311430228,bobbyclee,Bobby Lee - Ballet: World's EASIEST wallet!,,"The only way to stop #Bitcoin’s future price increase is to put a stop to the US dollar printing press.  Can that be done? Can our current monetary system (based on fiat money) survive without massive additional money printing? Sadly, I highly doubt it. Money printing is a given.",en,[],[],[],7,2,14,['bitcoin'],[],https://twitter.com/bobbyclee/status/1336146813070487555,False,,0,,,,,,,,[],,,,
1336146810491056131,1336144762353618948,2020-12-07 21:13:18 Hora estándar central (México),2020-12-07,21:13:18,-0500,311430228,bobbyclee,Bobby Lee - Ballet: World's EASIEST wallet!,,"The biggest factor will be the continued printing of $USD.  If we continue with quantitative easing monetary policies, where TRILLIONS of dollars are printed every yr, then the $19 million #Bitcoin is a forgone conclusion! Just matter of time.  After all $BTC is measured in $USD!",en,[],[],[],1,2,14,['bitcoin'],"['usd', 'btc', 'usd']",https://twitter.com/bobbyclee/status/1336146810491056131,False,,0,,,,,,,,[],,,,
1336144762353618948,1336144762353618948,2020-12-07 21:05:10 Hora estándar central (México),2020-12-07,21:05:10,-0500,311430228,bobbyclee,Bobby Lee - Ballet: World's EASIEST wallet!,,"Can #Bitcoin rise 1,000x from today’s price within the next 15 years (by the end of 2035) and reach $19+ million USD?  How many of you are as bullish as I am? I’ll share with you my thought process. #HODL",en,[],[],[],20,15,46,"['bitcoin', 'hodl']",[],https://twitter.com/bobbyclee/status/1336144762353618948,False,,0,,,,,,,,[],,,,
1334727035155927040,1334727035155927040,2020-12-03 23:11:37 Hora estándar central (México),2020-12-03,23:11:37,-0500,311430228,bobbyclee,Bobby Lee - Ballet: World's EASIEST wallet!,,"#Bitcoin is the first and only real #DeFi. Yield farming instructions: lock in your fiat and turn it into $BTC, HODL it for 5+ years, and get a huge return.",en,[],[],[],17,16,154,"['bitcoin', 'defi']",['btc'],https://twitter.com/bobbyclee/status/1334727035155927040,False,,0,,,,,,,,[],,,,
1333776302357221378,1333776302357221378,2020-12-01 08:13:45 Hora estándar central (México),2020-12-01,08:13:45,-0500,311430228,bobbyclee,Bobby Lee - Ballet: World's EASIEST wallet!,,The #Bitcoin bull market is coming... Stay tuned!  https://t.co/d11koQqlLt,en,[],[],['https://pbs.twimg.com/media/EoKGQGJUYAExiPH.jpg'],4,3,45,['bitcoin'],[],https://twitter.com/bobbyclee/status/1333776302357221378,False,,1,https://pbs.twimg.com/media/EoKGQGJUYAExiPH.jpg,,,,,,,[],,,,
1333776071011880962,1333776071011880962,2020-12-01 08:12:50 Hora estándar central (México),2020-12-01,08:12:50,-0500,311430228,bobbyclee,Bobby Lee - Ballet: World's EASIEST wallet!,,The #Bitcoin bull market is coming... Stay tuned!  https://t.co/D1b4hVc4l7,en,[],[],['https://pbs.twimg.com/media/EoKGQGJUYAExiPH.jpg'],1,4,56,['bitcoin'],[],https://twitter.com/bobbyclee/status/1333776071011880962,False,,1,https://pbs.twimg.com/media/EoKGQGJUYAExiPH.jpg,,,,,,,[],,,,
1333761734826344450,1333761734826344450,2020-12-01 07:15:52 Hora estándar central (México),2020-12-01,07:15:52,-0500,311430228,bobbyclee,Bobby Lee - Ballet: World's EASIEST wallet!,,"Like I’ve said, it’s going to be tough for #Bitcoin to cross the magic $20k.  In last 24 hrs, we saw 2 attempts at crossing $20k, but FAILED both times at around $19,900. A lot of selling action before we can officially start the bull market! Can it happen this month? Maybe not?!",en,[],[],[],7,5,46,['bitcoin'],[],https://twitter.com/bobbyclee/status/1333761734826344450,False,https://twitter.com/bobbyclee/status/1331621125672083456,0,,,,,,,,[],,,,
1332134067060477952,1331984974795350023,2020-11-26 19:28:06 Hora estándar central (México),2020-11-26,19:28:06,-0500,311430228,bobbyclee,Bobby Lee - Ballet: World's EASIEST wallet!,,"@MaximusGaucher Yes, these poker chips were all loaded. These are the denominations, in order from Purple to White colors: 0.500 BTC, 0.100 BTC, 0.025 BTC, 0.010 BTC, 0.005 BTC, and 0.001 BTC.  All in collectors hands now. Very rare to find.",en,[],[],[],1,0,0,[],[],https://twitter.com/bobbyclee/status/1332134067060477952,False,,0,,,,,,,,"[{'screen_name': 'MaximusGaucher', 'name': 'Samadhi', 'id': '97796721'}]",,,,
1331984974795350023,1331984974795350023,2020-11-26 09:35:39 Hora estándar central (México),2020-11-26,09:35:39,-0500,311430228,bobbyclee,Bobby Lee - Ballet: World's EASIEST wallet!,,"I designed the BTCC Mint poker chips to match the colors of casino chips in #LasVegas, based on a $BTC price of $1,000. (That was back in 2016, when #Bitcoin was way below $1,000.)  https://t.co/tZr3ZMyayh",en,[],[],['https://pbs.twimg.com/media/EnwpJsaUYAIF04J.jpg'],12,6,78,"['lasvegas', 'bitcoin']",['btc'],https://twitter.com/bobbyclee/status/1331984974795350023,False,,1,https://pbs.twimg.com/media/EnwpJsaUYAIF04J.jpg,,,,,,,[],,,,
1331621125672083456,1331619179259068420,2020-11-25 09:29:51 Hora estándar central (México),2020-11-25,09:29:51,-0500,311430228,bobbyclee,Bobby Lee - Ballet: World's EASIEST wallet!,,"$20k seems like just ~4% away, but there will be HUGE resistance for it to cross $20k. Expect some real pullback before we cross $20k.",en,[],[],[],10,0,36,[],[],https://twitter.com/bobbyclee/status/1331621125672083456,False,,0,,,,,,,,[],,,,
1331620418201989122,1331620418201989122,2020-11-25 09:27:02 Hora estándar central (México),2020-11-25,09:27:02,-0500,311430228,bobbyclee,Bobby Lee - Ballet: World's EASIEST wallet!,,"When #Bitcoin crosses $20k, I’ll remind everyone about my @Tesla #CyberTruck offer again. We still got time...😋😋😋",en,"[{'screen_name': 'tesla', 'name': 'tesla', 'id': '13298072'}]",[],[],1,2,24,"['bitcoin', 'cybertruck']",[],https://twitter.com/bobbyclee/status/1331620418201989122,False,https://twitter.com/bobbyclee/status/1331619179259068420,0,,,,,,,,[],,,,
1331619179259068420,1331619179259068420,2020-11-25 09:22:07 Hora estándar central (México),2020-11-25,09:22:07,-0500,311430228,bobbyclee,Bobby Lee - Ballet: World's EASIEST wallet!,,My guess is that #Bitcoin won’t break $20k until Q1.  Do any of you think it’ll happen this year? When will $BTC cross $20k?,en,[],[],[],17,5,32,['bitcoin'],['btc'],https://twitter.com/bobbyclee/status/1331619179259068420,False,,0,,,,,,,,[],,,,
1331457796961935360,1331457796961935360,2020-11-24 22:40:50 Hora estándar central (México),2020-11-24,22:40:50,-0500,311430228,bobbyclee,Bobby Lee - Ballet: World's EASIEST wallet!,,"When #Bitcoin was launched in early 2009, the US Dollar money supply (M2) was just at $8 trillion, roughly same size as #Gold. It then reached $16 trillion early this year. Just this year alone 2020, we are seeing M2 increase by another $4 trillion. Topping $20 trillion soon!",en,[],[],[],10,29,145,"['bitcoin', 'gold']",[],https://twitter.com/bobbyclee/status/1331457796961935360,False,,0,,,,,,,,[],,,,
1331175117968211970,1331175117968211970,2020-11-24 03:57:34 Hora estándar central (México),2020-11-24,03:57:34,-0500,311430228,bobbyclee,Bobby Lee - Ballet: World's EASIEST wallet!,,"It took quite a bit (of time and money) to break the $19k barrier. I didn’t expect it to happen until December or January 2021. Looks like there is some serious buying volume for #Bitcoin! Once we get past $20k, then we start the bull market!",en,[],[],[],8,11,112,['bitcoin'],[],https://twitter.com/bobbyclee/status/1331175117968211970,False,https://twitter.com/bobbyclee/status/1331173733533249537,0,,,,,,,,[],,,,
1331173733533249537,1331173733533249537,2020-11-24 03:52:04 Hora estándar central (México),2020-11-24,03:52:04,-0500,311430228,bobbyclee,Bobby Lee - Ballet: World's EASIEST wallet!,,"#bitcoin just hit $19,000 on @coinbase. Yay!",en,"[{'screen_name': 'coinbase', 'name': 'coinbase', 'id': '574032254'}]",[],[],10,11,161,['bitcoin'],[],https://twitter.com/bobbyclee/status/1331173733533249537,False,,0,,,,,,,,[],,,,
1330874347649581057,1330863222010724359,2020-11-23 08:02:25 Hora estándar central (México),2020-11-23,08:02:25,-0500,311430228,bobbyclee,Bobby Lee - Ballet: World's EASIEST wallet!,,$ETH hit $600 first (on @coinbase ),en,"[{'screen_name': 'coinbase', 'name': 'coinbase', 'id': '574032254'}]",[],[],2,0,25,[],['eth'],https://twitter.com/bobbyclee/status/1330874347649581057,False,,0,,,,,,,,[],,,,
1330863222010724359,1330863222010724359,2020-11-23 07:18:13 Hora estándar central (México),2020-11-23,07:18:13,-0500,311430228,bobbyclee,Bobby Lee - Ballet: World's EASIEST wallet!,,$ETH $600 versus $LTC $90.  Which will happen first?,en,[],[],[],11,3,15,[],"['eth', 'ltc']",https://twitter.com/bobbyclee/status/1330863222010724359,False,,0,,,,,,,,[],,,,
1323572888138514432,1323571455569719297,2020-11-03 04:29:01 Hora estándar central (México),2020-11-03,04:29:01,-0500,311430228,bobbyclee,Bobby Lee - Ballet: World's EASIEST wallet!,,"As for this #FOMO bull market #Bitcoin rally in 2021, I think at a minimum, we will reach $50k, and much more likely to top out in the range of $100k to $200k. $333k is my high-end estimate.   What's your guess?",en,[],[],[],6,3,36,"['fomo', 'bitcoin']",[],https://twitter.com/bobbyclee/status/1323572888138514432,False,,0,,,,,,,,[],,,,
1323571455569719297,1323571455569719297,2020-11-03 04:23:20 Hora estándar central (México),2020-11-03,04:23:20,-0500,311430228,bobbyclee,Bobby Lee - Ballet: World's EASIEST wallet!,,"We're now in late 2020; the #Bitcoin rally is about to start! After the US elections, I expect $BTC prices to rally &amp; end the year at $15k-$17k, and then top the previous ATH of $20k sometime in 2021 Q1.  2021 will be the bull market year for Bitcoin. HODL tight! Lucky year ""21"".",en,[],[],[],10,15,91,['bitcoin'],['btc'],https://twitter.com/bobbyclee/status/1323571455569719297,False,https://twitter.com/bobbyclee/status/1071100283638280194,0,,,,,,,,[],,,,
1323570040415776771,1323570040415776771,2020-11-03 04:17:43 Hora estándar central (México),2020-11-03,04:17:43,-0500,311430228,bobbyclee,Bobby Lee - Ballet: World's EASIEST wallet!,,"Over 3.5 years ago, in February 2017, I predicted that #Bitcoin prices would shoot up to between $5k to $11k after the May 2020 halving. (At the time, $BTC was only at $1,165.)",en,[],[],[],10,10,73,['bitcoin'],['btc'],https://twitter.com/bobbyclee/status/1323570040415776771,False,https://twitter.com/bobbyclee/status/835875006731034624,0,,,,,,,,[],,,,
1319313933761560578,1319164198241341440,2020-10-22 11:25:28 Hora de verano central (México),2020-10-22,11:25:28,-0500,311430228,bobbyclee,Bobby Lee - Ballet: World's EASIEST wallet!,,"@elonmusk If people upgrade &amp; buy FSD, will it follow the car when they later resell it? (or is FSD a one-time SW license for the current purchaser to use on this specific car VIN?)  What about the FSD when ordered w/ car? Does anyone know? @FredericLambert @llsethj @DMC_Ryan @TeslaPodcast",en,"[{'screen_name': 'fredericlambert', 'name': 'fred lambert', 'id': '38253449'}, {'screen_name': 'llsethj', 'name': 'seth weintraub', 'id': '1006521'}, {'screen_name': 'dmc_ryan', 'name': 'ryan mccaffrey', 'id': '308795969'}, {'screen_name': 'teslapodcast', 'name': 'rob maurer', 'id': '898021206967951360'}]",[],[],3,0,4,[],[],https://twitter.com/bobbyclee/status/1319313933761560578,False,,0,,,,,,,,"[{'screen_name': 'elonmusk', 'name': 'Elon Musk', 'id': '44196397'}]",,,,
1309832750455640064,1309832750455640064,2020-09-26 07:30:37 Hora de verano central (México),2020-09-26,07:30:37,-0500,311430228,bobbyclee,Bobby Lee - Ballet: World's EASIEST wallet!,,Let's see if any of you are thinking along the lines of what I'm getting at....  Tell me what you think is the single one fundamental reason that the iPhone is successful. Take a guess?,en,[],[],[],14,2,13,[],[],https://twitter.com/bobbyclee/status/1309832750455640064,False,https://twitter.com/bobbyclee/status/1309818623267975168,0,,,,,,,,[],,,,
1309818623267975168,1309818623267975168,2020-09-26 06:34:29 Hora de verano central (México),2020-09-26,06:34:29,-0500,311430228,bobbyclee,Bobby Lee - Ballet: World's EASIEST wallet!,,Why is the Apple iPhone successful?,en,[],[],[],27,1,22,[],[],https://twitter.com/bobbyclee/status/1309818623267975168,False,,0,,,,,,,,[],,,,
1307992821832409089,1307992821832409089,2020-09-21 05:39:24 Hora de verano central (México),2020-09-21,05:39:24,-0500,311430228,bobbyclee,Bobby Lee - Ballet: World's EASIEST wallet!,,"What is the Bitcoin block reward and why is it so important to the whole Bitcoin ecosystem? (And did you know that you can hold a full Bitcoin block reward in your hands, in the form of a physical block?)  Read my blog post about the Bitcoin block reward:  https://t.co/hUCD9JKNvQ",en,[],['https://www.bobbylee.com/blogs/news/what-is-the-bitcoin-block-reward'],[],6,3,22,[],[],https://twitter.com/bobbyclee/status/1307992821832409089,False,,0,,,,,,,,[],,,,
1307951617287749632,1307951617287749632,2020-09-21 02:55:40 Hora de verano central (México),2020-09-21,02:55:40,-0500,311430228,bobbyclee,Bobby Lee - Ballet: World's EASIEST wallet!,,"Please help me get broad coverage about this important issue affecting crypto wallets, and #retweet!",en,[],[],[],2,2,7,['retweet'],[],https://twitter.com/bobbyclee/status/1307951617287749632,False,https://twitter.com/bobbyclee/status/1306520562424934403,0,,,,,,,,[],,,,
1307378341549207552,1307378341549207552,2020-09-19 12:57:41 Hora de verano central (México),2020-09-19,12:57:41,-0500,311430228,bobbyclee,Bobby Lee - Ballet: World's EASIEST wallet!,,This is a great idea. The 1% should all learn from this: Donate and give away your wealth during your lifetime.   https://t.co/i9Tj2QNmR2,en,[],['https://apple.news/AHUsoyuGQRAi0tvizLJ4tmw'],[],3,3,9,[],[],https://twitter.com/bobbyclee/status/1307378341549207552,False,,0,,,,,,,,[],,,,
1307226233017491457,1307226233017491457,2020-09-19 02:53:15 Hora de verano central (México),2020-09-19,02:53:15,-0500,311430228,bobbyclee,Bobby Lee - Ballet: World's EASIEST wallet!,,"A guide to better EQ (emotional intelligence): An understanding of the 3 different words: empathy, sympathy and pity.   https://t.co/sZNaYiLgPB",en,[],['https://apple.news/AFzGsih4iSfGc107bC1pBWQ'],[],0,2,10,[],[],https://twitter.com/bobbyclee/status/1307226233017491457,False,,0,,,,,,,,[],,,,
1306753991330553856,1306753991330553856,2020-09-17 19:36:44 Hora de verano central (México),2020-09-17,19:36:44,-0500,311430228,bobbyclee,Bobby Lee - Ballet: World's EASIEST wallet!,,Playing poker again... come watch the live stream.  https://t.co/DEsP6A1vIk,en,[],['https://twitter.com/btcPokerGame/status/1306750353220620288?s=20'],[],0,0,7,[],[],https://twitter.com/bobbyclee/status/1306753991330553856,False,https://twitter.com/btcPokerGame/status/1306750353220620288?s=20,0,,,,,,,,[],,,,
