id,conversation_id,created_at,date,time,timezone,user_id,username,name,place,tweet,language,mentions,urls,photos,replies_count,retweets_count,likes_count,hashtags,cashtags,link,retweet,quote_url,video,thumbnail,near,geo,source,user_rt_id,user_rt,retweet_id,reply_to,retweet_date,translate,trans_src,trans_dest
1247993922183254016,1247993922183254016,2020-04-08 16:05:12 Hora de verano central (México),2020-04-08,16:05:12,-0500,311430228,bobbyclee,Bobby Lee - Ballet: World's EASIEST wallet!,,"Excited to be playing in this charity poker tournament! You can even join! See below for details, and maybe see you at the tables tomorrow.   @BalletCrypto is sponsoring, and will give out free REAL Bitcoin wallets to the top 100 players.",en,"[{'screen_name': 'balletcrypto', 'name': 'ballet', 'id': '1153538304580521985'}]",[],[],0,2,9,[],[],https://twitter.com/bobbyclee/status/1247993922183254016,False,https://twitter.com/BalletCrypto/status/1247989601467125761,0,,,,,,,,[],,,,
1245209877821001730,1244922107156287488,2020-03-31 22:42:24 Hora estándar central (México),2020-03-31,22:42:24,-0500,311430228,bobbyclee,Bobby Lee - Ballet: World's EASIEST wallet!,,@uzyn @YourBTCC ahm... No.  We didn't keep copies of the private keys for ANY of the BTCC Mint products.   Please don't spread unsubstantiated rumors.,en,[],[],[],4,1,9,[],[],https://twitter.com/bobbyclee/status/1245209877821001730,False,,0,,,,,,,,"[{'screen_name': 'uzyn', 'name': 'U-Zyn Chua 🍰', 'id': '1705281'}, {'screen_name': 'YourBTCC', 'name': 'BTCC', 'id': '2338229497'}]",,,,
1244942835662467074,1244922107156287488,2020-03-31 05:01:16 Hora estándar central (México),2020-03-31,05:01:16,-0500,311430228,bobbyclee,Bobby Lee - Ballet: World's EASIEST wallet!,,@Spoorburger @YourBTCC No auctions that I'm aware of... all of the 2015/2016 blocks are tightly held by collectors.  No one has come out and sold one in auction unfortunately.,en,[],[],[],0,0,0,[],[],https://twitter.com/bobbyclee/status/1244942835662467074,False,,0,,,,,,,,"[{'screen_name': 'Spoorburger', 'name': '$elnino 🍔', 'id': '292952757'}, {'screen_name': 'YourBTCC', 'name': 'BTCC', 'id': '2338229497'}]",,,,
1244929028877742080,1244922107156287488,2020-03-31 04:06:24 Hora estándar central (México),2020-03-31,04:06:24,-0500,311430228,bobbyclee,Bobby Lee - Ballet: World's EASIEST wallet!,,@saqm @YourBTCC Beware... it's VERY expensive.,en,[],[],[],1,0,1,[],[],https://twitter.com/bobbyclee/status/1244929028877742080,False,,0,,,,,,,,"[{'screen_name': 'saqm', 'name': 'Syed Abdul Khader', 'id': '83179172'}, {'screen_name': 'YourBTCC', 'name': 'BTCC', 'id': '2338229497'}]",,,,
1244922107156287488,1244922107156287488,2020-03-31 03:38:54 Hora estándar central (México),2020-03-31,03:38:54,-0500,311430228,bobbyclee,Bobby Lee - Ballet: World's EASIEST wallet!,,"Who remembers the #BitcoinBlock we made at @YourBTCC in 2016? We had both the 25+ BTC and 12.5+ BTC blocks, all loaded with virgin coinbase transactions, straight from the mining pool.  Every block is unique. The ultimate #Bitcoin collectible. Real bitcoin in your hand. Have one?  https://t.co/gnGl2rAmVa",en,"[{'screen_name': 'yourbtcc', 'name': 'btcc', 'id': '2338229497'}]",[],"['https://pbs.twimg.com/media/EUbY0F4U0AA-mnB.jpg', 'https://pbs.twimg.com/media/EUbY2LCU0AAI4oo.jpg', 'https://pbs.twimg.com/media/EUbY25nU8AEVm1D.jpg', 'https://pbs.twimg.com/media/EUbY3pbUUAA2kje.jpg']",18,22,106,"['bitcoinblock', 'bitcoin']",[],https://twitter.com/bobbyclee/status/1244922107156287488,False,,1,https://pbs.twimg.com/media/EUbY0F4U0AA-mnB.jpg,,,,,,,[],,,,
1242332439785029632,1242332439785029632,2020-03-24 00:08:29 Hora estándar central (México),2020-03-24,00:08:29,-0500,311430228,bobbyclee,Bobby Lee - Ballet: World's EASIEST wallet!,,"I enjoyed being on @TraceMayer’s podcast. I’m a big fan of #ProofOfKeys, and that’s why I created @BalletCrypto, to allow regular folks to hold onto &amp; control their private keys, and not leave their #Bitcoins on custodial wallets &amp; exchanges. Just keep it safe &amp; don’t lose it.",en,"[{'screen_name': 'tracemayer', 'name': 'trace mayer', 'id': '57689645'}, {'screen_name': 'balletcrypto', 'name': 'ballet', 'id': '1153538304580521985'}]",[],[],8,12,34,"['proofofkeys', 'bitcoins']",[],https://twitter.com/bobbyclee/status/1242332439785029632,False,https://twitter.com/BalletCrypto/status/1242254980951822337,0,,,,,,,,[],,,,
1238643960504963072,1238155914328358914,2020-03-13 19:51:47 Hora estándar central (México),2020-03-13,19:51:47,-0500,311430228,bobbyclee,Bobby Lee - Ballet: World's EASIEST wallet!,,@andrefmpbf @BalletCrypto Thanks! Have you used it yet?  Please tell me your experience after using it.,en,[],[],[],1,0,4,[],[],https://twitter.com/bobbyclee/status/1238643960504963072,False,,0,,,,,,,,"[{'screen_name': 'andrefmpbf', 'name': '.', 'id': '884455586280214528'}, {'screen_name': 'BalletCrypto', 'name': 'Ballet', 'id': '1153538304580521985'}]",,,,
1238533042831908864,1238533042831908864,2020-03-13 12:31:02 Hora estándar central (México),2020-03-13,12:31:02,-0500,311430228,bobbyclee,Bobby Lee - Ballet: World's EASIEST wallet!,,Who knows the highest level VP at @WellsFargo who can help me get to the bottom of this?  They declined my wire transfer with the reason that it was to protect me from fraud. Really?  Why won’t Wells Fargo bank fraud department actually come talk to me over the phone? Call me!,en,"[{'screen_name': 'wellsfargo', 'name': 'wells fargo', 'id': '1178011'}]",[],[],7,5,22,[],[],https://twitter.com/bobbyclee/status/1238533042831908864,False,https://twitter.com/bobbyclee/status/1238529672595423232,0,,,,,,,,[],,,,
1238531954196148224,1238529672595423232,2020-03-13 12:26:43 Hora estándar central (México),2020-03-13,12:26:43,-0500,311430228,bobbyclee,Bobby Lee - Ballet: World's EASIEST wallet!,,"It’s looks like even in America, freedom capital of the world, people like me still don’t have true ownership over our own money (if we left it at the bank).   What gives?  Am I allowed to withdraw as paper notes cash, and mail it to Hong Kong? @wellsfargo",en,"[{'screen_name': 'wellsfargo', 'name': 'wells fargo', 'id': '1178011'}]",[],[],12,8,77,[],[],https://twitter.com/bobbyclee/status/1238531954196148224,False,,0,,,,,,,,[],,,,
1238529672595423232,1238529672595423232,2020-03-13 12:17:39 Hora estándar central (México),2020-03-13,12:17:39,-0500,311430228,bobbyclee,Bobby Lee - Ballet: World's EASIEST wallet!,,"I’m at @WellsFargo branch in California, and they have just declined my request to transfer money to Hong Kong. They asked me for details of the reason for the transfer, and I merely asked them if I had a right to NOT reveal my business purposes. So I can’t move my own money now?",en,"[{'screen_name': 'wellsfargo', 'name': 'wells fargo', 'id': '1178011'}]",[],[],68,49,287,[],[],https://twitter.com/bobbyclee/status/1238529672595423232,False,,0,,,,,,,,[],,,,
1235057365990301696,1235057365990301696,2020-03-03 22:19:56 Hora estándar central (México),2020-03-03,22:19:56,-0500,311430228,bobbyclee,Bobby Lee - Ballet: World's EASIEST wallet!,,"And I’ve carried these @BalletCrypto stainless steel wallets through airport security X-ray scanners, and they just show up as complete black blobs. No visible text whatsoever.",en,"[{'screen_name': 'balletcrypto', 'name': 'ballet', 'id': '1153538304580521985'}]",[],[],5,4,14,[],[],https://twitter.com/bobbyclee/status/1235057365990301696,False,https://twitter.com/MarkHutto/status/1234628291392262144,0,,,,,,,,[],,,,
1235056952272535557,1234628291392262144,2020-03-03 22:18:18 Hora estándar central (México),2020-03-03,22:18:18,-0500,311430228,bobbyclee,Bobby Lee - Ballet: World's EASIEST wallet!,,@Econ_Rockstar @MarkHutto @BalletCrypto Ultrasound won’t have the resolution needed to decipher the text of the phassphrase or the encrypted private keys.,en,[],[],[],1,0,2,[],[],https://twitter.com/bobbyclee/status/1235056952272535557,False,,0,,,,,,,,"[{'screen_name': 'Econ_Rockstar', 'name': 'Frrrank Conway Technoking of Econ', 'id': '2534876480'}, {'screen_name': 'MarkHutto', 'name': 'M. G. Hutto', 'id': '22804541'}, {'screen_name': 'BalletCrypto', 'name': 'Ballet', 'id': '1153538304580521985'}]",,,,
1232889164011433984,1231250189920260098,2020-02-26 22:44:17 Hora estándar central (México),2020-02-26,22:44:17,-0500,311430228,bobbyclee,Bobby Lee - Ballet: World's EASIEST wallet!,,"@adam3us @MarkHutto @nvk @unconfiscatable @BalletCrypto @ToneVays @jimmysong @peterktodd @TraceMayer 100% agree.   Custodians have to be trusted for long time, until they stop operating the custody service. And customers also risk having their online accounts breached by hackers &amp; identity theft.  CoinMakers only have to be trusted at the time they create &amp; delete private keys.",en,[],[],[],1,1,9,[],[],https://twitter.com/bobbyclee/status/1232889164011433984,False,,0,,,,,,,,"[{'screen_name': 'adam3us', 'name': 'Adam Back', 'id': '213236426'}, {'screen_name': 'MarkHutto', 'name': 'M. G. Hutto', 'id': '22804541'}, {'screen_name': 'nvk', 'name': 'DETERMINISTIC OPTIMISM', 'id': '10446482'}, {'screen_name': 'unconfiscatable', 'name': 'Unconfiscatable', 'id': '983549247348916224'}, {'screen_name': 'BalletCrypto', 'name': 'Ballet', 'id': '1153538304580521985'}, {'screen_name': 'ToneVays', 'name': 'Tone Vays (#EndLockdowns)', 'id': '2577886615'}, {'screen_name': 'jimmysong', 'name': 'Jimmy Song (송재준)', 'id': '21263333'}, {'screen_name': 'peterktodd', 'name': 'Peter Todd', 'id': '1471313300'}, {'screen_name': 'TraceMayer', 'name': 'Trace Mayer', 'id': '57689645'}]",,,,
1232887883242987520,1232887874996957185,2020-02-26 22:39:11 Hora estándar central (México),2020-02-26,22:39:11,-0500,311430228,bobbyclee,Bobby Lee - Ballet: World's EASIEST wallet!,,"Until then, we'll continue to answer every question with as much specificity and transparency as possible.  Thank you @nvk for bringing up this important topic, and I look forward to having more of these discussions with you and other experts.",en,"[{'screen_name': 'nvk', 'name': 'deterministic optimism', 'id': '10446482'}]",[],[],0,2,5,[],[],https://twitter.com/bobbyclee/status/1232887883242987520,False,,0,,,,,,,,[],,,,
1232887882227974144,1232887874996957185,2020-02-26 22:39:11 Hora estándar central (México),2020-02-26,22:39:11,-0500,311430228,bobbyclee,Bobby Lee - Ballet: World's EASIEST wallet!,,"We're open to suggestions from security experts &amp; other vendors, about how best to perform a comprehensive security audit of our multinational two-factor key generation &amp; manufacturing process.   We would pay for travel and expenses for a qualified expert(s) to conduct an audit.",en,[],[],[],1,1,3,[],[],https://twitter.com/bobbyclee/status/1232887882227974144,False,,0,,,,,,,,[],,,,
1232887881028366336,1232887874996957185,2020-02-26 22:39:11 Hora estándar central (México),2020-02-26,22:39:11,-0500,311430228,bobbyclee,Bobby Lee - Ballet: World's EASIEST wallet!,,"We have yet to find an established &amp; reputable standards organization that can conduct this type of audit, to issue a certification that is recognized by the cryptocurrency industry.  This isn’t only a challenge for us, but for every company in the industry.",en,[],[],[],1,0,4,[],[],https://twitter.com/bobbyclee/status/1232887881028366336,False,,0,,,,,,,,[],,,,
1232887879497437184,1232887874996957185,2020-02-26 22:39:11 Hora estándar central (México),2020-02-26,22:39:11,-0500,311430228,bobbyclee,Bobby Lee - Ballet: World's EASIEST wallet!,,"I ran a major exchange for 5 years (BTCChina @YourBTCC) and manufactured 22,000+ physical bitcoins at BTCC Mint (loaded with 8,700+ BTC), with no security failures.  A qualified auditor would at least need to have this kind of private key security experience as I do.",en,"[{'screen_name': 'yourbtcc', 'name': 'btcc', 'id': '2338229497'}]",[],[],1,0,4,[],[],https://twitter.com/bobbyclee/status/1232887879497437184,False,,0,,,,,,,,[],,,,
1232887877106667526,1232887874996957185,2020-02-26 22:39:10 Hora estándar central (México),2020-02-26,22:39:10,-0500,311430228,bobbyclee,Bobby Lee - Ballet: World's EASIEST wallet!,,We haven't had an independent security audit yet.  We're currently unaware of any qualified experts who publicly offer this service. We reached out to traditional certification entities like ISO-9000; they declined b/c they're not qualified (no experience) to evaluate our process,en,[],[],[],1,0,3,[],[],https://twitter.com/bobbyclee/status/1232887877106667526,False,,0,,,,,,,,[],,,,
1232887874996957185,1232887874996957185,2020-02-26 22:39:10 Hora estándar central (México),2020-02-26,22:39:10,-0500,311430228,bobbyclee,Bobby Lee - Ballet: World's EASIEST wallet!,,"If we published the results of a successful audit, wouldn't the critics just move the goalposts and accuse us of generating the keys differently when the auditor isn't watching?  Nevertheless, we're committed to maximum transparency, so long as it doesn't put security at risk.",en,[],[],[],3,2,4,[],[],https://twitter.com/bobbyclee/status/1232887874996957185,False,https://twitter.com/nvk/status/1231412982757888001,0,,,,,,,,[],,,,
1231775100472451072,1231775100472451072,2020-02-23 20:57:23 Hora estándar central (México),2020-02-23,20:57:23,-0500,311430228,bobbyclee,Bobby Lee - Ballet: World's EASIEST wallet!,,"I reached the final table today, and finished #5 at the #unconfiscatable conference #poker tournament! The $BTC prizes were given out on @BalletCrypto physical wallets! It was super easy &amp; awesome. @ToneVays - Thanks again for organizing a GREAT conference in #LasVegas.  https://t.co/nS0hS4QuZO",en,"[{'screen_name': 'balletcrypto', 'name': 'ballet', 'id': '1153538304580521985'}, {'screen_name': 'tonevays', 'name': 'tone vays (#endlockdowns)', 'id': '2577886615'}]",[],['https://pbs.twimg.com/media/ERgk7AdVUAARa4K.jpg'],1,11,70,"['unconfiscatable', 'poker', 'lasvegas']",['btc'],https://twitter.com/bobbyclee/status/1231775100472451072,False,,1,https://pbs.twimg.com/media/ERgk7AdVUAARa4K.jpg,,,,,,,[],,,,
1231773864650108928,1231773864650108928,2020-02-23 20:52:29 Hora estándar central (México),2020-02-23,20:52:29,-0500,311430228,bobbyclee,Bobby Lee - Ballet: World's EASIEST wallet!,,Thanks for the #HODL hat from @hodlcap  Amazing poker tournament at #unconfiscatable conference in #LasVegas  https://t.co/MXwI4NqQo0,en,"[{'screen_name': 'hodlcap', 'name': 'hodlbrand', 'id': '981730160608194560'}]",[],['https://pbs.twimg.com/media/ERgjyNnU8AADsWX.jpg'],1,5,14,"['hodl', 'unconfiscatable', 'lasvegas']",[],https://twitter.com/bobbyclee/status/1231773864650108928,False,,1,https://pbs.twimg.com/media/ERgjyNnU8AADsWX.jpg,,,,,,,[],,,,
1231335233959550977,1231055847586820096,2020-02-22 15:49:31 Hora estándar central (México),2020-02-22,15:49:31,-0500,311430228,bobbyclee,Bobby Lee - Ballet: World's EASIEST wallet!,,@oliver_90210 @BalletCrypto Yes! Poker tournament tomorrow.,en,[],[],[],1,0,3,[],[],https://twitter.com/bobbyclee/status/1231335233959550977,False,,0,,,,,,,,"[{'screen_name': 'oliver_90210', 'name': 'Crypt0liver', 'id': '833239595030560769'}, {'screen_name': 'BalletCrypto', 'name': 'Ballet', 'id': '1153538304580521985'}]",,,,
1231250189920260098,1231250189920260098,2020-02-22 10:11:35 Hora estándar central (México),2020-02-22,10:11:35,-0500,311430228,bobbyclee,Bobby Lee - Ballet: World's EASIEST wallet!,,@nvk I wish you were here at @unconfiscatable this year. I was really looking forward to debating the merits of @BalletCrypto physical wallets compared to electronic hardware wallets. Maybe next time!  @ToneVays @jimmysong @adam3us @peterktodd @TraceMayer #bitcoin,en,"[{'screen_name': 'unconfiscatable', 'name': 'unconfiscatable', 'id': '983549247348916224'}, {'screen_name': 'balletcrypto', 'name': 'ballet', 'id': '1153538304580521985'}, {'screen_name': 'tonevays', 'name': 'tone vays (#endlockdowns)', 'id': '2577886615'}, {'screen_name': 'jimmysong', 'name': 'jimmy song (송재준)', 'id': '21263333'}, {'screen_name': 'adam3us', 'name': 'adam back', 'id': '213236426'}, {'screen_name': 'peterktodd', 'name': 'peter todd', 'id': '1471313300'}, {'screen_name': 'tracemayer', 'name': 'trace mayer', 'id': '57689645'}]",[],[],6,1,9,['bitcoin'],[],https://twitter.com/bobbyclee/status/1231250189920260098,False,,0,,,,,,,,[],,,,
1231055847586820096,1231055847586820096,2020-02-21 21:19:20 Hora estándar central (México),2020-02-21,21:19:20,-0500,311430228,bobbyclee,Bobby Lee - Ballet: World's EASIEST wallet!,,"As I’m here at the conference, if you are also here in #LasVegas and have questions or concerns about @BalletCrypto wallets, I welcome you to come meet me &amp; discuss face-to-face. Don’t be afraid, come say hi! I will address all critiques of our non-electronic physical wallet.",en,"[{'screen_name': 'balletcrypto', 'name': 'ballet', 'id': '1153538304580521985'}]",[],[],4,9,39,['lasvegas'],[],https://twitter.com/bobbyclee/status/1231055847586820096,False,https://twitter.com/bobbyclee/status/1230904314660442112,0,,,,,,,,[],,,,
1230929937890066433,1230929937890066433,2020-02-21 12:59:01 Hora estándar central (México),2020-02-21,12:59:01,-0500,311430228,bobbyclee,Bobby Lee - Ballet: World's EASIEST wallet!,,Check out my interview on Michelle's @laptop_radio show. It was broadcast on @KZSU Stanford radio this week. Apple Podcast  https://t.co/jvtYJXy0wz Google Music  https://t.co/PE5eeMok35  https://t.co/6AfeQojLDB,en,"[{'screen_name': 'laptop_radio', 'name': 'laptop radio', 'id': '920816873154928640'}, {'screen_name': 'kzsu', 'name': 'kzsu 90.1 fm', 'id': '46706038'}]","['http://bit.ly/LaptopRadioiTunes', 'http://bit.ly/LaptopRadioGooglePlay']",['https://pbs.twimg.com/media/ERUkPqJUwAACEGI.jpg'],0,5,11,[],[],https://twitter.com/bobbyclee/status/1230929937890066433,False,,1,https://pbs.twimg.com/media/ERUkPqJUwAACEGI.jpg,,,,,,,[],,,,
1230904314660442112,1230904314660442112,2020-02-21 11:17:12 Hora estándar central (México),2020-02-21,11:17:12,-0500,311430228,bobbyclee,Bobby Lee - Ballet: World's EASIEST wallet!,,"I’m speaking at the @unconfiscatable conference in #LasVegas tomorrow. Come join us, and EVERY attendee gets a FREE @BalletCrypto wallet!  https://t.co/KfyUyaCMGm",en,"[{'screen_name': 'unconfiscatable', 'name': 'unconfiscatable', 'id': '983549247348916224'}, {'screen_name': 'balletcrypto', 'name': 'ballet', 'id': '1153538304580521985'}]",[],['https://pbs.twimg.com/media/ERUM8sVUUAEcsPY.jpg'],3,5,27,['lasvegas'],[],https://twitter.com/bobbyclee/status/1230904314660442112,False,,1,https://pbs.twimg.com/media/ERUM8sVUUAEcsPY.jpg,,,,,,,[],,,,
1229562192426438657,1229562192426438657,2020-02-17 18:24:05 Hora estándar central (México),2020-02-17,18:24:05,-0500,311430228,bobbyclee,Bobby Lee - Ballet: World's EASIEST wallet!,,"If you‘re a @Ravencoin fan, please be sure to back our @kickstarter campaign for the REAL Ravencoin physical wallet by @BalletCrypto   Just less than 2 days left!",en,"[{'screen_name': 'ravencoin', 'name': 'project raven 🦅/ rvn / ravencoin', 'id': '910233733265018880'}, {'screen_name': 'kickstarter', 'name': 'kickstarter', 'id': '16186995'}, {'screen_name': 'balletcrypto', 'name': 'ballet', 'id': '1153538304580521985'}]",[],[],2,12,43,[],[],https://twitter.com/bobbyclee/status/1229562192426438657,False,https://twitter.com/tronblack/status/1229480112434880512,0,,,,,,,,[],,,,
1229561054415339520,1229561054415339520,2020-02-17 18:19:34 Hora estándar central (México),2020-02-17,18:19:34,-0500,311430228,bobbyclee,Bobby Lee - Ballet: World's EASIEST wallet!,,You should all check out @alex_van_aken’s short video review of the Ballet wallet. He’s spot on &amp; did a great job explaining the key benefits of our wallet design. Thank you Alex!  Can’t wait to see his next follow up video about using the @BalletCrypto mobile app to send funds.,en,"[{'screen_name': 'alex_van_aken', 'name': 'alex the anarchist', 'id': '1099887575685197824'}, {'screen_name': 'balletcrypto', 'name': 'ballet', 'id': '1153538304580521985'}]",[],[],2,9,19,[],[],https://twitter.com/bobbyclee/status/1229561054415339520,False,https://twitter.com/alex_van_aken/status/1228776745064550400,0,,,,,,,,[],,,,
1227729116025118720,1227729116025118720,2020-02-12 17:00:06 Hora estándar central (México),2020-02-12,17:00:06,-0500,311430228,bobbyclee,Bobby Lee - Ballet: World's EASIEST wallet!,,"Absolutely GREAT investigative reporting by the @washingtonpost — this special report details the secret CIA ownership of encryption machine vendor. It goes to show that #Trust is always needed when it comes to physical devices, mechanical or electronic.   https://t.co/WkJR5KONwx",en,"[{'screen_name': 'washingtonpost', 'name': 'the washington post', 'id': '2467791'}]",['https://www.washingtonpost.com/graphics/2020/world/national-security/cia-crypto-encryption-machines-espionage/?itid=hp_ed-picks-mobile_crypto211%3Ahomepage%2Fstory-ans'],[],2,9,22,['trust'],[],https://twitter.com/bobbyclee/status/1227729116025118720,False,,0,,,,,,,,[],,,,
1225990820420935686,1225990820420935686,2020-02-07 21:52:44 Hora estándar central (México),2020-02-07,21:52:44,-0500,311430228,bobbyclee,Bobby Lee - Ballet: World's EASIEST wallet!,,Any #Ravencoin supporters out there? We are planning to make a really cool REAL Ravencoin edition of the @BalletCrypto physical cryptocurrency wallet. Come to our Kickstarter page to back this campaign! Ends on Feb 19.,en,"[{'screen_name': 'balletcrypto', 'name': 'ballet', 'id': '1153538304580521985'}]",[],[],6,16,62,['ravencoin'],[],https://twitter.com/bobbyclee/status/1225990820420935686,False,https://twitter.com/BalletCrypto/status/1225854573903921153,0,,,,,,,,[],,,,
1220680394514653188,1220680394514653188,2020-01-24 06:10:59 Hora estándar central (México),2020-01-24,06:10:59,-0500,311430228,bobbyclee,Bobby Lee - Ballet: World's EASIEST wallet!,,I just sent 0.001 BTC gift to everyone who received the @BalletCrypto Red Envelope 🧧edition of our wallet. Let’s celebrate the Year of the Rat 🐭 Happy Lunar New Year to everyone around the world!  Ballet is the easiest way to give people #Bitcoin.  https://t.co/4Z8JXj943T,en,"[{'screen_name': 'balletcrypto', 'name': 'ballet', 'id': '1153538304580521985'}]",[],['https://pbs.twimg.com/media/EPC6VvRU8AAHgpv.jpg'],19,19,108,['bitcoin'],[],https://twitter.com/bobbyclee/status/1220680394514653188,False,,1,https://pbs.twimg.com/media/EPC6VvRU8AAHgpv.jpg,,,,,,,[],,,,
1220021801419304963,1220021801419304963,2020-01-22 10:33:59 Hora estándar central (México),2020-01-22,10:33:59,-0500,311430228,bobbyclee,Bobby Lee - Ballet: World's EASIEST wallet!,,"This century, global disease &amp; epidemics (Ebola,SARS) could be like the Great Wars from last century, causing refugees &amp; mass migrations...  If so, buying &amp; HODLing #Bitcoin today would be the equivalent to carrying &amp; hoarding #Gold last century.  So watch $BTC prices rally soon!",en,[],[],[],0,20,58,"['bitcoin', 'gold']",['btc'],https://twitter.com/bobbyclee/status/1220021801419304963,False,,0,,,,,,,,[],,,,
1219256420857606144,1219256420857606144,2020-01-20 07:52:38 Hora estándar central (México),2020-01-20,07:52:38,-0500,311430228,bobbyclee,Bobby Lee - Ballet: World's EASIEST wallet!,,"As I say in interview with @lil_cryp Chain Talk, no one has more incentive than me to ensure @BalletCrypto wallet private keys are generated securely and not saved by the company. Accusations of intent to steal from users are not based on logic or facts.   https://t.co/1lTOUOf0MR",en,"[{'screen_name': 'lil_cryp', 'name': 'e (btcnews.io) 🟠', 'id': '1082305500685856769'}, {'screen_name': 'balletcrypto', 'name': 'ballet', 'id': '1153538304580521985'}]",['https://www.youtube.com/watch?v=gAUwpehJLAY&feature=youtu.be&t=1142'],[],9,10,33,[],[],https://twitter.com/bobbyclee/status/1219256420857606144,False,,0,,,,,,,,[],,,,
1219254736362209280,1217474936358555648,2020-01-20 07:45:56 Hora estándar central (México),2020-01-20,07:45:56,-0500,311430228,bobbyclee,Bobby Lee - Ballet: World's EASIEST wallet!,,@h4rdnoxlyfe @bitcoinbbq @BalletCrypto @keynote_ae Which exchange?,en,[],[],[],0,0,1,[],[],https://twitter.com/bobbyclee/status/1219254736362209280,False,,0,,,,,,,,"[{'screen_name': 'h4rdnoxlyfe', 'name': 'Eye2EyeSlowJerk', 'id': '1213692591373312000'}, {'screen_name': 'bitcoinbbq', 'name': '₿₿Q 🟩🥟🥩', 'id': '38013633'}, {'screen_name': 'BalletCrypto', 'name': 'Ballet', 'id': '1153538304580521985'}, {'screen_name': 'keynote_ae', 'name': 'btcmiami.com', 'id': '1440661586'}]",,,,
1219248652280926209,1218998549519552512,2020-01-20 07:21:45 Hora estándar central (México),2020-01-20,07:21:45,-0500,311430228,bobbyclee,Bobby Lee - Ballet: World's EASIEST wallet!,,@BTCTKVR @TraceMayer @BalletCrypto Yes indeed! Please email media@balletcrypto.com to schedule it.,en,[],[],[],1,0,2,[],[],https://twitter.com/bobbyclee/status/1219248652280926209,False,,0,,,,,,,,"[{'screen_name': 'BTCTKVR', 'name': 'Bitcoin Takeover', 'id': '1198150944665542656'}, {'screen_name': 'TraceMayer', 'name': 'Trace Mayer', 'id': '57689645'}, {'screen_name': 'BalletCrypto', 'name': 'Ballet', 'id': '1153538304580521985'}]",,,,
1219247782306803712,1219247782306803712,2020-01-20 07:18:18 Hora estándar central (México),2020-01-20,07:18:18,-0500,311430228,bobbyclee,Bobby Lee - Ballet: World's EASIEST wallet!,,This is the perfect example of why I created the @BalletCrypto wallet. It’s a simple physical non-electronic wallet for storing Bitcoin and other Cryptos. There nothing for the user to remember or memorize (other than to not lose the physical wallet). Human memory is fallible!,en,"[{'screen_name': 'balletcrypto', 'name': 'ballet', 'id': '1153538304580521985'}]",[],[],4,4,31,[],[],https://twitter.com/bobbyclee/status/1219247782306803712,False,https://twitter.com/ErikVoorhees/status/1219046141028982784,0,,,,,,,,[],,,,
