id,conversation_id,created_at,date,time,timezone,user_id,username,name,place,tweet,language,mentions,urls,photos,replies_count,retweets_count,likes_count,hashtags,cashtags,link,retweet,quote_url,video,thumbnail,near,geo,source,user_rt_id,user_rt,retweet_id,reply_to,retweet_date,translate,trans_src,trans_dest
1396818263733047296,1396818263733047296,2021-05-24 08:20:00 Hora de verano central (México),2021-05-24,08:20:00,-0500,44728980,ancalerts,ABS-CBN News Channel,,"Crypto miners halt China business after Beijing cracks down, bitcoin tumbles  https://t.co/BycLYmVm3Q",en,[],['https://bit.ly/3wuCsad'],[],0,4,8,[],[],https://twitter.com/ANCALERTS/status/1396818263733047296,False,,0,,,,,,,,[],,,,
1396715083204603908,1396715083204603908,2021-05-24 01:30:00 Hora de verano central (México),2021-05-24,01:30:00,-0500,44728980,ancalerts,ABS-CBN News Channel,,Knowledge on fundamentals to help crypto traders ride volatility  https://t.co/wTqwXvNn6B,en,[],['https://bit.ly/3oIIfpW'],[],0,2,3,[],[],https://twitter.com/ANCALERTS/status/1396715083204603908,False,,0,,,,,,,,[],,,,
1392673452054781955,1392673452054781955,2021-05-12 21:50:00 Hora de verano central (México),2021-05-12,21:50:00,-0500,44728980,ancalerts,ABS-CBN News Channel,,Facebook-backed crypto project Diem shifts to US  https://t.co/draXmReVzF,en,[],['https://bit.ly/3eIhUoB'],[],0,3,6,[],[],https://twitter.com/ANCALERTS/status/1392673452054781955,False,,0,,,,,,,,[],,,,
1390194058694324225,1390193997226733569,2021-05-06 01:37:46 Hora de verano central (México),2021-05-06,01:37:46,-0500,44728980,ancalerts,ABS-CBN News Channel,,"@wddeguzman BSP: However, there are other factors to consider including capacity building and BSP readiness to manage risks related to crypto. | via @wddeguzman",en,"[{'screen_name': 'wddeguzman', 'name': 'warren de guzman', 'id': '48330559'}]",[],[],0,0,6,[],[],https://twitter.com/ANCALERTS/status/1390194058694324225,False,,0,,,,,,,,"[{'screen_name': 'wddeguzman', 'name': 'Warren de Guzman', 'id': '48330559'}]",,,,
1386069940701077505,1386069940701077505,2021-04-24 16:30:00 Hora de verano central (México),2021-04-24,16:30:00,-0500,44728980,ancalerts,ABS-CBN News Channel,,Turkey probes second crypto exchange as market implodes   https://t.co/QTUxDufDBZ,en,[],['https://bit.ly/2S1Rg19'],[],0,0,9,[],[],https://twitter.com/ANCALERTS/status/1386069940701077505,False,,0,,,,,,,,[],,,,
1371997885542232073,1371992372641361921,2021-03-16 19:32:41 Hora estándar central (México),2021-03-16,19:32:41,-0500,44728980,ancalerts,ABS-CBN News Channel,,"@michelle_d_ong Moneybees CEO Paulo del Puerto: We don't have digital app; we only offer over-the-counter service in our 7 outlets to allow cryptocurrency users to cash in, cash out using their own crypto trading platform like Binance | via @michelle_d_ong #MarketEdge  https://t.co/geH6oMtNEo",en,"[{'screen_name': 'michelle_d_ong', 'name': 'michelle krystle ong', 'id': '616166780'}]",[],['https://pbs.twimg.com/media/EwpQe_qU8AMd-BU.png'],1,0,3,['marketedge'],[],https://twitter.com/ANCALERTS/status/1371997885542232073,False,,1,https://pbs.twimg.com/media/EwpQe_qU8AMd-BU.png,,,,,,,"[{'screen_name': 'michelle_d_ong', 'name': 'Michelle Krystle Ong', 'id': '616166780'}]",,,,
1352078192035549184,1352061582826643457,2021-01-20 20:18:56 Hora estándar central (México),2021-01-20,20:18:56,-0500,44728980,ancalerts,ABS-CBN News Channel,,"@michelle_d_ong #MarketEdge Noble: Under Biden era, we expect developments in a crypto-based lending system and budding derivatives market; central banks/ govts expected to develop their own stable coins too; volatility not necessarily a bad thing | via @michelle_d_ong",en,"[{'screen_name': 'michelle_d_ong', 'name': 'michelle krystle ong', 'id': '616166780'}]",[],[],1,0,3,['marketedge'],[],https://twitter.com/ANCALERTS/status/1352078192035549184,False,,0,,,,,,,,"[{'screen_name': 'michelle_d_ong', 'name': 'Michelle Krystle Ong', 'id': '616166780'}]",,,,
1332105605192904705,1332105605192904705,2020-11-26 17:35:00 Hora estándar central (México),2020-11-26,17:35:00,-0500,44728980,ancalerts,ABS-CBN News Channel,,"Crypto exchange Coinbase hit by connection, latency problems as bitcoin plummets  https://t.co/WtwthKMopC",en,[],['https://bit.ly/2V8U6Q2'],[],0,3,5,[],[],https://twitter.com/ANCALERTS/status/1332105605192904705,False,,0,,,,,,,,[],,,,
1276404828500099073,1276404828500099073,2020-06-26 01:40:00 Hora de verano central (México),2020-06-26,01:40:00,-0500,44728980,ancalerts,ABS-CBN News Channel,,"Thailand targets narco millions hidden in gold, steel and crypto  https://t.co/fxJ5aCZW73",en,[],['https://bit.ly/2NuJrvj'],[],0,2,3,[],[],https://twitter.com/ANCALERTS/status/1276404828500099073,False,,0,,,,,,,,[],,,,
1168355363315486725,1168355363315486725,2019-09-01 21:50:00 Hora de verano central (México),2019-09-01,21:50:00,-0500,44728980,ancalerts,ABS-CBN News Channel,,Manny Pacquiao launches his own 'Pac' crypto tokens  https://t.co/ZGKMSxqekg,en,[],['http://bit.ly/2ZFrYIf'],[],0,0,11,[],[],https://twitter.com/ANCALERTS/status/1168355363315486725,False,,0,,,,,,,,[],,,,
1166548456921423872,1166548456921423872,2019-08-27 22:10:00 Hora de verano central (México),2019-08-27,22:10:00,-0500,44728980,ancalerts,ABS-CBN News Channel,,Telegram plans to offer ‘Gram’ crypto coin  https://t.co/INRO4RYhbi,en,[],['http://bit.ly/2Pip9ZQ'],[],0,0,5,[],[],https://twitter.com/ANCALERTS/status/1166548456921423872,False,,0,,,,,,,,[],,,,
1154421049796235267,1154421049796235267,2019-07-25 11:00:01 Hora de verano central (México),2019-07-25,11:00:01,-0500,44728980,ancalerts,ABS-CBN News Channel,,Chinese crypto promoter apologizes after postponing Warren Buffett charity lunch  https://t.co/hjFCaXzxkf,en,[],['http://bit.ly/2ZbI1tJ'],[],0,1,6,[],[],https://twitter.com/ANCALERTS/status/1154421049796235267,False,,0,,,,,,,,[],,,,
1121690375968526336,1121690375968526336,2019-04-26 03:20:00 Hora de verano central (México),2019-04-26,03:20:00,-0500,44728980,ancalerts,ABS-CBN News Channel,,"Hamas shifts tactics in bitcoin fundraising, highlighting crypto risks - research  https://t.co/dxzWEN1pT7",en,[],['http://bit.ly/2GAZOm5'],[],0,1,5,[],[],https://twitter.com/ANCALERTS/status/1121690375968526336,False,,0,,,,,,,,[],,,,
1061885952879194112,1061866371380924416,2018-11-12 01:38:34 Hora estándar central (México),2018-11-12,01:38:34,-0500,44728980,ancalerts,ABS-CBN News Channel,,"@kevinolearytv @KerOliva .@kevinolearytv on crypto-currency: For me, I would not park any serious money there. #KevinOLearyOnANC | via @KerOliva",en,"[{'screen_name': 'kevinolearytv', 'name': ""kevin o'leary aka mr. wonderful"", 'id': '32002507'}, {'screen_name': 'keroliva', 'name': 'ker oliva', 'id': '4899214645'}]",[],[],1,0,1,['kevinolearyonanc'],[],https://twitter.com/ANCALERTS/status/1061885952879194112,False,,0,,,,,,,,"[{'screen_name': 'kevinolearytv', 'name': ""Kevin O'Leary aka Mr. Wonderful"", 'id': '32002507'}, {'screen_name': 'KerOliva', 'name': 'Ker Oliva', 'id': '4899214645'}]",,,,
1061885869467017218,1061866371380924416,2018-11-12 01:38:14 Hora estándar central (México),2018-11-12,01:38:14,-0500,44728980,ancalerts,ABS-CBN News Channel,,"@kevinolearytv @KerOliva .@kevinolearytv on crypto-currency: Most currencies in the world provide interest. They accrue value. Bitcoin does on do that. In a way, it's speculation. #KevinOLearyOnANC | via @KerOliva",en,"[{'screen_name': 'kevinolearytv', 'name': ""kevin o'leary aka mr. wonderful"", 'id': '32002507'}, {'screen_name': 'keroliva', 'name': 'ker oliva', 'id': '4899214645'}]",[],[],1,0,1,['kevinolearyonanc'],[],https://twitter.com/ANCALERTS/status/1061885869467017218,False,,0,,,,,,,,"[{'screen_name': 'kevinolearytv', 'name': ""Kevin O'Leary aka Mr. Wonderful"", 'id': '32002507'}, {'screen_name': 'KerOliva', 'name': 'Ker Oliva', 'id': '4899214645'}]",,,,
1001100793934635009,1001100793934635009,2018-05-28 09:00:03 Hora de verano central (México),2018-05-28,09:00:03,-0500,44728980,ancalerts,ABS-CBN News Channel,,What you need to know before investing in crypto  https://t.co/HkzAyHG7sQ,en,[],['http://bit.ly/2kuSzl2'],[],0,3,4,[],[],https://twitter.com/ANCALERTS/status/1001100793934635009,False,,0,,,,,,,,[],,,,
983904973103575040,983904973103575040,2018-04-10 22:10:00 Hora de verano central (México),2018-04-10,22:10:00,-0500,44728980,ancalerts,ABS-CBN News Channel,,"Crypto-jacking, malicious mobile apps rose in 2017: report  https://t.co/mMRV4YUpJZ",en,[],['http://bit.ly/2IKnN1w'],[],0,0,5,[],[],https://twitter.com/ANCALERTS/status/983904973103575040,False,,0,,,,,,,,[],,,,
975517204480278528,975517204480278528,2018-03-18 17:40:00 Hora estándar central (México),2018-03-18,17:40:00,-0500,44728980,ancalerts,ABS-CBN News Channel,,"Crypto assets don't pose immediate risk, says world body  https://t.co/OxCxnkLfDo",en,[],['http://bit.ly/2FUfRtN'],[],0,2,5,[],[],https://twitter.com/ANCALERTS/status/975517204480278528,False,,0,,,,,,,,[],,,,
973418375270543360,973418375270543360,2018-03-12 22:40:00 Hora estándar central (México),2018-03-12,22:40:00,-0500,44728980,ancalerts,ABS-CBN News Channel,,Hacked Japan crypto exchange refunds customers  https://t.co/EzeZWVmszM,en,[],['http://bit.ly/2FB6Gyg'],[],0,1,6,[],[],https://twitter.com/ANCALERTS/status/973418375270543360,False,,0,,,,,,,,[],,,,
971698290193559554,971698290193559554,2018-03-08 04:45:00 Hora estándar central (México),2018-03-08,04:45:00,-0500,44728980,ancalerts,ABS-CBN News Channel,,Japan punishes crypto exchanges after hack  https://t.co/DAlKdieLAP,en,[],['http://bit.ly/2p2tH6i'],[],0,1,13,[],[],https://twitter.com/ANCALERTS/status/971698290193559554,False,,0,,,,,,,,[],,,,
964162384901189633,964162384901189633,2018-02-15 09:40:00 Hora estándar central (México),2018-02-15,09:40:00,-0500,44728980,ancalerts,ABS-CBN News Channel,,Number of crypto hedge funds soars amid bitcoin volatility  https://t.co/0m2rymhJjD,en,[],['http://bit.ly/2EtzBUx'],[],1,2,4,[],[],https://twitter.com/ANCALERTS/status/964162384901189633,False,,0,,,,,,,,[],,,,
