id,conversation_id,created_at,date,time,timezone,user_id,username,name,place,tweet,language,mentions,urls,photos,replies_count,retweets_count,likes_count,hashtags,cashtags,link,retweet,quote_url,video,thumbnail,near,geo,source,user_rt_id,user_rt,retweet_id,reply_to,retweet_date,translate,trans_src,trans_dest
1395090807863009283,1395090807863009283,2021-05-19 13:55:42 Hora de verano central (México),2021-05-19,13:55:42,-0500,91478624,forbes,Forbes,,"Amid Sell-Off And Extreme Volatility, Investors Should Be Wary About Cryptocurrencies, UBS Warns  https://t.co/TfyFrsfK3N  https://t.co/ic50qg7UYX",en,[],['https://www.forbes.com/sites/palashghosh/2021/05/19/amid-sell-off-and-extreme-volatility-investors-should-be-wary-about-cryptocurrencies-ubs-warns/?utm_campaign=forbes&utm_source=twitter&utm_medium=social&utm_term=Gordie'],['https://pbs.twimg.com/media/E1xbsm2WEAYntlK.jpg'],12,24,98,[],[],https://twitter.com/Forbes/status/1395090807863009283,False,,1,https://pbs.twimg.com/media/E1xbsm2WEAYntlK.jpg,,,,,,,[],,,,
1392087141740650497,1392087141740650497,2021-05-11 07:00:12 Hora de verano central (México),2021-05-11,07:00:12,-0500,91478624,forbes,Forbes,,"Ethereum, Cardano and these other surging cryptocurrencies are propelling the market to $2.5 trillion  https://t.co/id3d6OXOdR  https://t.co/BFkWtkCovn",en,[],['https://trib.al/whNw1vx'],['https://pbs.twimg.com/media/E1Gv4GiWEAM3HTn.jpg'],11,57,217,[],[],https://twitter.com/Forbes/status/1392087141740650497,False,,1,https://pbs.twimg.com/media/E1Gv4GiWEAM3HTn.jpg,,,,,,,[],,,,
1391862135442100226,1391862135442100226,2021-05-10 16:06:07 Hora de verano central (México),2021-05-10,16:06:07,-0500,91478624,forbes,Forbes,,"Ethereum, Cardano and these other surging cryptocurrencies are propelling the market to $2.5 trillion  https://t.co/ihsEg43BBY  https://t.co/he8aLPl8GL",en,[],['https://trib.al/E7B0hDf'],['https://pbs.twimg.com/media/E1DjO9KWUAUyAp-.jpg'],9,38,188,[],[],https://twitter.com/Forbes/status/1391862135442100226,False,,1,https://pbs.twimg.com/media/E1DjO9KWUAUyAp-.jpg,,,,,,,[],,,,
1391810284247998468,1391810284247998468,2021-05-10 12:40:05 Hora de verano central (México),2021-05-10,12:40:05,-0500,91478624,forbes,Forbes,,"Ethereum, Cardano and these other surging cryptocurrencies are propelling the market to $2.5 trillion  https://t.co/woPPACRmfZ  https://t.co/Ym6pWdrLGh",en,[],['https://trib.al/7gfJvfQ'],['https://pbs.twimg.com/media/E1C0E5EXMAgvO1o.jpg'],2,30,124,[],[],https://twitter.com/Forbes/status/1391810284247998468,False,,1,https://pbs.twimg.com/media/E1C0E5EXMAgvO1o.jpg,,,,,,,[],,,,
1391790347932610565,1391790347932610565,2021-05-10 11:20:51 Hora de verano central (México),2021-05-10,11:20:51,-0500,91478624,forbes,Forbes,,"Ethereum, Cardano And These Other Surging Cryptocurrencies Are Propelling The Market To $2.5 Trillion  https://t.co/UKKBzGaHsO  https://t.co/IZsMRpRRhE",en,[],['https://www.forbes.com/sites/jonathanponciano/2021/05/10/ethereum-dogecoin-cardano-cryptocurrencies-propelling-the-market-to-25-trillion/?utm_campaign=forbes&utm_source=twitter&utm_medium=social&utm_term=Gordie'],['https://pbs.twimg.com/media/E1Ch8jGX0AE7uhZ.jpg'],7,39,168,[],[],https://twitter.com/Forbes/status/1391790347932610565,False,,1,https://pbs.twimg.com/media/E1Ch8jGX0AE7uhZ.jpg,,,,,,,[],,,,
1389027941430988803,1389027941430988803,2021-05-02 20:24:02 Hora de verano central (México),2021-05-02,20:24:02,-0500,91478624,forbes,Forbes,,"The demand for luxury travel is increasing again and through a new service, clients can now pay with a choice of 40 cryptocurrencies  https://t.co/LQ91HMV4sk  https://t.co/kYuad8r6Ax",en,[],['https://trib.al/xdsO51c'],['https://pbs.twimg.com/media/E0bRjU6WYAEIFFn.jpg'],8,29,122,[],[],https://twitter.com/Forbes/status/1389027941430988803,False,,1,https://pbs.twimg.com/media/E0bRjU6WYAEIFFn.jpg,,,,,,,[],,,,
1378415514247135238,1378415514247135238,2021-04-03 12:34:02 Hora estándar central (México),2021-04-03,12:34:02,-0500,91478624,forbes,Forbes,,"The total market value of cryptocurrencies is approaching $2 trillion -  that’s bigger than the market caps of Amazon, Google and Microsoft  https://t.co/7yFbESzBCf  https://t.co/ccATT1jYKL",en,[],['https://trib.al/a1iJwtj'],['https://pbs.twimg.com/media/EyEdmv-WUAQ0MqQ.jpg'],16,57,169,[],[],https://twitter.com/Forbes/status/1378415514247135238,False,,1,https://pbs.twimg.com/media/EyEdmv-WUAQ0MqQ.jpg,,,,,,,[],,,,
1373720089824989184,1373720089824989184,2021-03-21 13:36:06 Hora estándar central (México),2021-03-21,13:36:06,-0500,91478624,forbes,Forbes,,"Despite bitcoin's recent success, some fear that central bank digital currencies (CBDCs) could be ""kryptonite"" for bitcoin and similar cryptocurrencies.  https://t.co/w9NFoR48kw",en,[],['https://trib.al/KGOOUkX'],[],20,30,75,[],[],https://twitter.com/Forbes/status/1373720089824989184,False,,0,,,,,,,,[],,,,
1372601192858198017,1372601192858198017,2021-03-18 11:30:00 Hora estándar central (México),2021-03-18,11:30:00,-0500,91478624,forbes,Forbes,,This segment of What’s Ahead examines the battle that’s about to begin between governments and creators of cryptocurrencies such as Bitcoin  https://t.co/GfAGmpvGEM  https://t.co/QBv35L1ay3,en,[],['https://www.forbes.com/sites/steveforbes/2021/03/18/indias-plan-to-ban-bitcoin-could-the-us-be-next/?utm_source=twitter_video&utm_medium=social&utm_campaign=forbes'],[],1,9,30,[],[],https://twitter.com/Forbes/status/1372601192858198017,False,,1,https://pbs.twimg.com/media/Ewxg143XMAYoEf9.jpg,,,,,,,[],,,,
1369816356552597510,1369816356552597510,2021-03-10 19:04:04 Hora estándar central (México),2021-03-10,19:04:04,-0500,91478624,forbes,Forbes,,JPMorgan is giving clients a way to gain exposure to bitcoin and other cryptocurrencies through a structured note offering tied to a basket of stocks related to the assets  https://t.co/ZDF0k9caTk  https://t.co/pPU4OsT8yS,en,[],['https://trib.al/6iICEjE'],['https://pbs.twimg.com/media/EwKQt1GWgAIRazR.png'],4,21,51,[],[],https://twitter.com/Forbes/status/1369816356552597510,False,,1,https://pbs.twimg.com/media/EwKQt1GWgAIRazR.png,,,,,,,[],,,,
1369789169854255105,1369789169854255105,2021-03-10 17:16:02 Hora estándar central (México),2021-03-10,17:16:02,-0500,91478624,forbes,Forbes,,JPMorgan is giving clients a way to gain exposure to bitcoin and other cryptocurrencies through a structured note offering tied to a basket of stocks related to the assets  https://t.co/Mcw146vvU1  https://t.co/ksAUuSuqVj,en,[],['https://trib.al/CaefE2X'],['https://pbs.twimg.com/media/EwJ3_XqXEA4rAN4.png'],5,24,64,[],[],https://twitter.com/Forbes/status/1369789169854255105,False,,1,https://pbs.twimg.com/media/EwJ3_XqXEA4rAN4.png,,,,,,,[],,,,
1350166110344253440,1350166110344253440,2021-01-15 13:41:00 Hora estándar central (México),2021-01-15,13:41:00,-0500,91478624,forbes,Forbes,,"The price of Bitcoin has jumped almost eight-fold since March, but this segment of #WhatsAhead cautions Bitcoin and other cryptocurrencies are not yet substitutes for the dollar  https://t.co/t2sJFT7yHn  https://t.co/NqwXUrw6LM",en,[],['https://www.forbes.com/sites/steveforbes/2021/01/15/could-bitcoin-replace-the-us-dollar/?utm_source=twitter_video&utm_medium=social&utm_campaign=forbes'],[],14,26,95,['whatsahead'],[],https://twitter.com/Forbes/status/1350166110344253440,False,,1,https://pbs.twimg.com/media/EryK8AlXEAABQ12.jpg,,,,,,,[],,,,
1319288664359251971,1319288664359251971,2020-10-22 09:45:03 Hora de verano central (México),2020-10-22,09:45:03,-0500,91478624,forbes,Forbes,,"PayPal finally welcomes cryptocurrencies, including bitcoin and ethereum  https://t.co/kanACd4lBy  https://t.co/Ke9LOewKdM",en,[],['http://on.forbes.com/6014GAc86'],['https://pbs.twimg.com/media/Ek8ODE6VgAgkBLY.jpg'],6,87,248,[],[],https://twitter.com/Forbes/status/1319288664359251971,False,,1,https://pbs.twimg.com/media/Ek8ODE6VgAgkBLY.jpg,,,,,,,[],,,,
1243202012872945664,1243202012872945664,2020-03-26 09:43:52 Hora estándar central (México),2020-03-26,09:43:52,-0500,91478624,forbes,Forbes,,"As the price of bitcoin and other cryptocurrencies collapsed last week one of the largest cryptocurrency exchange in America went on a hiring spree, looking to grow its job force by almost 10%  https://t.co/S6Um70Jx3c  https://t.co/3qwRthyJ5s",en,[],['http://on.forbes.com/60151vOFH'],['https://pbs.twimg.com/media/EUC9pBXXsAIE4bU.jpg'],1,9,20,[],[],https://twitter.com/Forbes/status/1243202012872945664,False,,1,https://pbs.twimg.com/media/EUC9pBXXsAIE4bU.jpg,,,,,,,[],,,,
1202297771635740672,1202297771635740672,2019-12-04 12:45:01 Hora estándar central (México),2019-12-04,12:45:01,-0500,91478624,forbes,Forbes,,"The underworld of bitcoin and other cryptocurrencies now has its own Valachi papers, detailing how criminals laundered a record $3.7 billion so far this year, but with a blockchain twist  https://t.co/SPZdor5oat  https://t.co/DHagggItKQ",en,[],['http://on.forbes.com/60171rPIS'],['https://pbs.twimg.com/media/EK9rc5nWwAA7TQg.jpg'],1,23,66,[],[],https://twitter.com/Forbes/status/1202297771635740672,False,,1,https://pbs.twimg.com/media/EK9rc5nWwAA7TQg.jpg,,,,,,,[],,,,
1158502943164792833,1158502943164792833,2019-08-05 17:20:00 Hora de verano central (México),2019-08-05,17:20:00,-0500,91478624,forbes,Forbes,,"While Steve Bannon's comments put him at odds with President Trump on bitcoin and cryptocurrencies, their goals appear to be the same  https://t.co/v8fFAA0OCd  https://t.co/LB7PFPlCYF",en,[],['https://www.forbes.com/sites/billybambrough/2019/08/05/donald-trump-and-steve-bannon-in-surprise-bitcoin-split/?utm_source=twitter_video&utm_medium=social&utm_campaign=forbes'],[],4,16,33,[],[],https://twitter.com/Forbes/status/1158502943164792833,False,,1,https://pbs.twimg.com/media/EBO29VpXoAIGjY7.jpg,,,,,,,[],,,,
1150215840090009600,1150215840090009600,2019-07-13 20:30:00 Hora de verano central (México),2019-07-13,20:30:00,-0500,91478624,forbes,Forbes,,"Professional sports franchises, leagues and athletes are no strangers to cryptocurrencies. Now, the Miami Dolphins are joining in  https://t.co/yzrvj6ifGJ  https://t.co/wp3OB82kqu",en,[],['http://on.forbes.com/6011EvbR7'],['https://pbs.twimg.com/media/D_ZjNhEWkAIgHE4.jpg'],2,9,43,[],[],https://twitter.com/Forbes/status/1150215840090009600,False,,1,https://pbs.twimg.com/media/D_ZjNhEWkAIgHE4.jpg,,,,,,,[],,,,
1149728881013927937,1149728881013927937,2019-07-12 12:15:00 Hora de verano central (México),2019-07-12,12:15:00,-0500,91478624,forbes,Forbes,,The Miami Dolphins will start accepting cryptocurrencies for payments  https://t.co/zYVovJ9mvw  https://t.co/k9UhYnzL3h,en,[],['http://on.forbes.com/6010EvbRy'],['https://pbs.twimg.com/media/D_SoUxwWwAAetMr.jpg'],8,61,210,[],[],https://twitter.com/Forbes/status/1149728881013927937,False,,1,https://pbs.twimg.com/media/D_SoUxwWwAAetMr.jpg,,,,,,,[],,,,
1143213449679462400,1143213449679462400,2019-06-24 12:45:00 Hora de verano central (México),2019-06-24,12:45:00,-0500,91478624,forbes,Forbes,,"Cryptocurrencies rallied over the weekend, with Bitcoin passing the $10K mark; Madonna's new album snags #1 on the Billboard 200; several billionaires call for a wealth tax. All this and more in today's #DailyDozen  https://t.co/t03uAsOvQZ  https://t.co/0Tpxe2d12H",en,[],['http://on.forbes.com/6012ESb4E'],['https://pbs.twimg.com/media/D92CkvtXYAgrCrK.jpg'],6,34,75,['dailydozen'],[],https://twitter.com/Forbes/status/1143213449679462400,False,,1,https://pbs.twimg.com/media/D92CkvtXYAgrCrK.jpg,,,,,,,[],,,,
1132773404984139777,1132773404984139777,2019-05-26 17:20:00 Hora de verano central (México),2019-05-26,17:20:00,-0500,91478624,forbes,Forbes,,"Mark Zuckerberg, who has taken a vastly different approach to bitcoin and cryptocurrencies to his fellow social media CEO Jack Dorsey, appears to be more interested in supplanting bitcoin than developing it  https://t.co/UB3kQP91vu  https://t.co/H9uODfduMI",en,[],['https://www.forbes.com/sites/billybambrough/2019/05/24/facebook-and-whatsapp-break-cover-with-bitcoin-rival-plans/?utm_source=twitter_video&utm_medium=social&utm_campaign=forbes'],[],6,41,104,[],[],https://twitter.com/Forbes/status/1132773404984139777,False,,1,https://pbs.twimg.com/media/D7WPXZJXYAACaAS.jpg,,,,,,,[],,,,
1131552867750502400,1131552867750502400,2019-05-23 08:30:01 Hora de verano central (México),2019-05-23,08:30:01,-0500,91478624,forbes,Forbes,,"Jack Dorsey, the chief executive of Twitter, is taking further steps toward incorporating bitcoin and cryptocurrencies into his payments business, Square  https://t.co/JHrgKuJxfD  https://t.co/D0rkYMo2cM",en,[],['http://on.forbes.com/6010EYC4G'],['https://pbs.twimg.com/media/D7QVVh_X4AEzs0h.jpg'],6,24,96,[],[],https://twitter.com/Forbes/status/1131552867750502400,False,,1,https://pbs.twimg.com/media/D7QVVh_X4AEzs0h.jpg,,,,,,,[],,,,
1127223085546049536,1127223085546049536,2019-05-11 09:45:01 Hora de verano central (México),2019-05-11,09:45:01,-0500,91478624,forbes,Forbes,,Facebook has had a change of heart with regards to advertising material related to blockchain and cryptocurrencies on its platform  https://t.co/gEFBXYvAAi  https://t.co/ham3faadqE,en,[],['http://on.forbes.com/6019E9I0b'],['https://pbs.twimg.com/media/D6SzbC6WAAAniuN.jpg'],3,17,34,[],[],https://twitter.com/Forbes/status/1127223085546049536,False,,1,https://pbs.twimg.com/media/D6SzbC6WAAAniuN.jpg,,,,,,,[],,,,
1121794821654364162,1121794821654364162,2019-04-26 10:15:02 Hora de verano central (México),2019-04-26,10:15:02,-0500,91478624,forbes,Forbes,,Lawmakers are making a fresh attempt to give cryptocurrencies a clearer legal standing in the U.S.  https://t.co/iNFUs5byXc via @coindesk  https://t.co/1tj1XF29Q3,en,"[{'screen_name': 'coindesk', 'name': 'coindesk', 'id': '1333467482'}]",['http://on.forbes.com/6010Ees5A'],['https://pbs.twimg.com/media/D5Fqcd7VUAIiXF_.jpg'],2,15,47,[],[],https://twitter.com/Forbes/status/1121794821654364162,False,,1,https://pbs.twimg.com/media/D5Fqcd7VUAIiXF_.jpg,,,,,,,[],,,,
1121451305719955457,1121451305719955457,2019-04-25 11:30:01 Hora de verano central (México),2019-04-25,11:30:01,-0500,91478624,forbes,Forbes,,"UK-based payment platform, Wirex, has announced the launch of 26 fiat-backed cryptocurrencies on the Stellar Network  https://t.co/426oAcmUdf  https://t.co/bftDMxazCo",en,[],['http://on.forbes.com/6015E5uE5'],['https://pbs.twimg.com/media/D5AyBO8XkAA3Ytg.jpg'],11,85,231,[],[],https://twitter.com/Forbes/status/1121451305719955457,False,,1,https://pbs.twimg.com/media/D5AyBO8XkAA3Ytg.jpg,,,,,,,[],,,,
1119005232846057472,1119005232846057472,2019-04-18 17:30:12 Hora de verano central (México),2019-04-18,17:30:12,-0500,91478624,forbes,Forbes,,"Cryptocurrencies may be in the depths of winter, but it’s early spring for new business applications using the technology underlying bitcoin  https://t.co/Ue9lRAZxJk #Blockchain50  https://t.co/dUx1huDsik",en,[],['http://on.forbes.com/6014EeElI'],['https://pbs.twimg.com/tweet_video_thumb/D4eBSWDWAAI5oW4.jpg'],0,5,17,['blockchain50'],[],https://twitter.com/Forbes/status/1119005232846057472,False,,1,https://pbs.twimg.com/tweet_video_thumb/D4eBSWDWAAI5oW4.jpg,,,,,,,[],,,,
1118963662851584000,1118963662851584000,2019-04-18 14:45:01 Hora de verano central (México),2019-04-18,14:45:01,-0500,91478624,forbes,Forbes,,"Welcome to the brave new world of enterprise blockchain, where corporations are embracing the technology underlying cryptocurrencies like bitcoin and using it to speed up business processes  https://t.co/U0YKqrzdmg #Blockchain50  https://t.co/sISoIWSqg5",en,[],['http://on.forbes.com/6019EeEih'],['https://pbs.twimg.com/media/D4dbhYyXkAASkUw.jpg'],1,14,42,['blockchain50'],[],https://twitter.com/Forbes/status/1118963662851584000,False,,1,https://pbs.twimg.com/media/D4dbhYyXkAASkUw.jpg,,,,,,,[],,,,
1118537102709460995,1118537102709460995,2019-04-17 10:30:01 Hora de verano central (México),2019-04-17,10:30:01,-0500,91478624,forbes,Forbes,,"Global corporations on the Forbes #Blockchain50 list are embracing the technology underlying cryptocurrencies like bitcoin because they want to speed up business processes, increase transparency and potentially save billions of dollars  https://t.co/D0InyhLasV  https://t.co/zuiPUuV7NY",en,[],['http://on.forbes.com/6019EdtMW'],['https://pbs.twimg.com/media/D4XXkSOW4AAX6Uy.jpg'],2,17,49,['blockchain50'],[],https://twitter.com/Forbes/status/1118537102709460995,False,,1,https://pbs.twimg.com/media/D4XXkSOW4AAX6Uy.jpg,,,,,,,[],,,,
1118186041326874624,1118186041326874624,2019-04-16 11:15:01 Hora de verano central (México),2019-04-16,11:15:01,-0500,91478624,forbes,Forbes,,"Comcast owns MState, a venture capital firm investing in enterprise blockchain startups. Find out what other companies are embracing the technology underlying cryptocurrencies on this year's #Blockchain50 list:  https://t.co/Eqyju37Ema  https://t.co/H7vwxqhYMM",en,[],['http://on.forbes.com/6013EdUl7'],['https://pbs.twimg.com/media/D4SYR0MXsAEZTpg.jpg'],1,13,31,['blockchain50'],[],https://twitter.com/Forbes/status/1118186041326874624,False,,1,https://pbs.twimg.com/media/D4SYR0MXsAEZTpg.jpg,,,,,,,[],,,,
1118144563783270400,1118144563783270400,2019-04-16 08:30:12 Hora de verano central (México),2019-04-16,08:30:12,-0500,91478624,forbes,Forbes,,"Cryptocurrencies may be in the depths of winter, but it’s early spring for new business applications using the technology underlying bitcoin. Meet the billion dollar babies that made this year's #Blockchain50 list:  https://t.co/3ct84wpM3q  https://t.co/ZHWRpHU8L6",en,[],['http://on.forbes.com/6012EdUkE'],['https://pbs.twimg.com/tweet_video_thumb/D4Rygz0WwAAWO-4.jpg'],30,59,127,['blockchain50'],[],https://twitter.com/Forbes/status/1118144563783270400,False,,1,https://pbs.twimg.com/tweet_video_thumb/D4Rygz0WwAAWO-4.jpg,,,,,,,[],,,,
1118132183896662016,1118132183896662016,2019-04-16 07:41:01 Hora de verano central (México),2019-04-16,07:41:01,-0500,91478624,forbes,Forbes,,"Welcome to the brave new world of enterprise blockchain, where corporations are embracing the technology underlying cryptocurrencies like bitcoin and using it to speed up business processes  https://t.co/6qVzyCTYpM #Blockchain50  https://t.co/8bsmPZ8Vh6",en,[],['http://on.forbes.com/6018Edo2s'],['https://pbs.twimg.com/media/D4RnS6NWAAMFDCb.jpg'],5,48,109,['blockchain50'],[],https://twitter.com/Forbes/status/1118132183896662016,False,,1,https://pbs.twimg.com/media/D4RnS6NWAAMFDCb.jpg,,,,,,,[],,,,
1115939985738223616,1115939985738223616,2019-04-10 06:30:00 Hora de verano central (México),2019-04-10,06:30:00,-0500,91478624,forbes,Forbes,,The merchant ecosystem as a means to adopt cryptocurrencies:  https://t.co/oaa574nMlD  https://t.co/y1nVTr7Bdw,en,[],['https://www.forbes.com/sites/yoavvilner/2019/04/08/the-merchant-ecosystem-as-a-mean-to-adopt-cryptocurrencies/?utm_source=twitter_video&utm_medium=social&utm_campaign=forbes'],[],4,16,46,[],[],https://twitter.com/Forbes/status/1115939985738223616,False,,1,https://pbs.twimg.com/media/D3wXsDoWwAARS1J.jpg,,,,,,,[],,,,
1115728596805586944,1115728596805586944,2019-04-09 16:30:01 Hora de verano central (México),2019-04-09,16:30:01,-0500,91478624,forbes,Forbes,,Is the merchant ecosystem one of the most efficient channels to support mainstream adoption of cryptocurrencies?  https://t.co/t9g9woTFRU  https://t.co/0TiVAcSuKT,en,[],['http://on.forbes.com/6015EjbLH'],['https://pbs.twimg.com/media/D3vdPuRWkAADh3g.jpg'],3,4,22,[],[],https://twitter.com/Forbes/status/1115728596805586944,False,,1,https://pbs.twimg.com/media/D3vdPuRWkAADh3g.jpg,,,,,,,[],,,,
1100127043524706304,1100127043524706304,2019-02-25 14:15:01 Hora estándar central (México),2019-02-25,14:15:01,-0500,91478624,forbes,Forbes,,Getting pension funds to invest in crypto is an important development that could unleash a flood of money into cryptocurrencies—and the technology supporting them  https://t.co/lQLoYZadyW  https://t.co/rVZkxpKzhF,en,[],['http://on.forbes.com/6010Epq6m'],['https://pbs.twimg.com/media/D0Rvt0PW0AAIw-H.jpg'],3,8,42,[],[],https://twitter.com/Forbes/status/1100127043524706304,False,,1,https://pbs.twimg.com/media/D0Rvt0PW0AAIw-H.jpg,,,,,,,[],,,,
1096907076167716864,1096907076167716864,2019-02-16 17:00:01 Hora estándar central (México),2019-02-16,17:00:01,-0500,91478624,forbes,Forbes,,JP Morgan's move into cryptocurrencies might signal the end of Ripple  https://t.co/8Tj6ixLRwT  https://t.co/IL6pD0ITA0,en,[],['http://on.forbes.com/6012ET1Ea'],['https://pbs.twimg.com/media/Dzj_LCoWsAEfDn_.jpg'],1,28,49,[],[],https://twitter.com/Forbes/status/1096907076167716864,False,,1,https://pbs.twimg.com/media/Dzj_LCoWsAEfDn_.jpg,,,,,,,[],,,,
1096510714238459905,1096510714238459905,2019-02-15 14:45:01 Hora estándar central (México),2019-02-15,14:45:01,-0500,91478624,forbes,Forbes,,"JP Morgan’s chairman and CEO famously said he would fire any JP Morgan employee who traded in cryptocurrencies. Now, the institutional investor is launching its own cryptocurrency, JPM Coin  https://t.co/0HZ5jqlZJI  https://t.co/FW8fSx2Elx",en,[],['http://on.forbes.com/6018ET1Es'],['https://pbs.twimg.com/media/DzeWrv0X4AM8rJE.jpg'],3,32,52,[],[],https://twitter.com/Forbes/status/1096510714238459905,False,,1,https://pbs.twimg.com/media/DzeWrv0X4AM8rJE.jpg,,,,,,,[],,,,
1092837792441421824,1092837792441421824,2019-02-05 11:30:08 Hora estándar central (México),2019-02-05,11:30:08,-0500,91478624,forbes,Forbes,,"In the late 1990s Google transformed the Web by creating a fast, accurate and easy-to-use search engine. Now it could do the same for blockchains, the technology underlying cryptocurrencies like ethereum  https://t.co/gPb9GSsc2R by @DelRayMan  https://t.co/eIPQFIkUjS",en,"[{'screen_name': 'delrayman', 'name': 'michael del castillo', 'id': '126915737'}]",['http://on.forbes.com/6012ERnB0'],['https://pbs.twimg.com/tweet_video_thumb/DyqKJ6bWsAEibUU.jpg'],5,44,93,[],[],https://twitter.com/Forbes/status/1092837792441421824,False,,1,https://pbs.twimg.com/tweet_video_thumb/DyqKJ6bWsAEibUU.jpg,,,,,,,[],,,,
1087990825085210627,1087990825085210627,2019-01-23 02:30:01 Hora estándar central (México),2019-01-23,02:30:01,-0500,91478624,forbes,Forbes,,General counsel-turned-CEO helps organizations cut through the confusion of cryptocurrencies @KLGates #paid  https://t.co/2fP07c0ZfS  https://t.co/EtZ214kWYx,en,"[{'screen_name': 'klgates', 'name': 'k&l gates llp', 'id': '135967393'}]",['http://on.forbes.com/6012EPBKs'],['https://pbs.twimg.com/media/DxlR47eXcAIbVXF.jpg'],0,10,28,['paid'],[],https://twitter.com/Forbes/status/1087990825085210627,False,,1,https://pbs.twimg.com/media/DxlR47eXcAIbVXF.jpg,,,,,,,[],,,,
1086365485074128901,1086365485074128901,2019-01-18 14:51:29 Hora estándar central (México),2019-01-18,14:51:29,-0500,91478624,forbes,Forbes,,Wyoming is setting new legal precedents for the classification of cryptocurrencies in a bid to offer clarity to businesses and users of blockchain and digital assets  https://t.co/CqKUGpKJvZ  https://t.co/5A3fMTB8Vv,en,[],['http://on.forbes.com/6014EObKI'],['https://pbs.twimg.com/media/DxOLprzXcAApNyr.jpg'],4,13,38,[],[],https://twitter.com/Forbes/status/1086365485074128901,False,,1,https://pbs.twimg.com/media/DxOLprzXcAApNyr.jpg,,,,,,,[],,,,
1075922554479620096,1075922554479620096,2018-12-20 19:15:01 Hora estándar central (México),2018-12-20,19:15:01,-0500,91478624,forbes,Forbes,,New York billionaire John Catsimatidis on equity investing and cryptocurrencies:  https://t.co/GKCx5KU5v9  https://t.co/7iDpwWUGM0,en,[],['http://on.forbes.com/6018EEctM'],['https://pbs.twimg.com/media/Du5x3IUXgAAo1OY.jpg'],5,11,51,[],[],https://twitter.com/Forbes/status/1075922554479620096,False,,1,https://pbs.twimg.com/media/Du5x3IUXgAAo1OY.jpg,,,,,,,[],,,,
1068312408786173952,1068312408786173952,2018-11-29 19:15:01 Hora estándar central (México),2018-11-29,19:15:01,-0500,91478624,forbes,Forbes,,New York billionaire John Catsimatidis on equity investing and cryptocurrencies:  https://t.co/FNf8tDsx3U  https://t.co/CbGyd2IqYI,en,[],['http://on.forbes.com/6019EEcst'],['https://pbs.twimg.com/media/DtNoeVxXcAAX4G0.jpg'],2,13,33,[],[],https://twitter.com/Forbes/status/1068312408786173952,False,,1,https://pbs.twimg.com/media/DtNoeVxXcAAX4G0.jpg,,,,,,,[],,,,
1054481271299194881,1054481271299194881,2018-10-22 16:15:01 Hora de verano central (México),2018-10-22,16:15:01,-0500,91478624,forbes,Forbes,,Vo1t is a secret global network of underground data centres where companies keep their cryptocurrencies safe  https://t.co/UJ7DyQ8S2P  https://t.co/xk7ND7lddC,en,[],['http://on.forbes.com/6014D7UUm'],['https://pbs.twimg.com/media/DqJFILzWkAA2pzF.jpg'],1,14,25,[],[],https://twitter.com/Forbes/status/1054481271299194881,False,,1,https://pbs.twimg.com/media/DqJFILzWkAA2pzF.jpg,,,,,,,[],,,,
1038170050706976770,1038170050706976770,2018-09-07 16:00:03 Hora de verano central (México),2018-09-07,16:00:03,-0500,91478624,forbes,Forbes,,Are decentralizing cryptocurrencies the future?  https://t.co/E6ojTUah7c  https://t.co/i7J8DUJkGX,en,[],['http://on.forbes.com/6015DLVBD'],['https://pbs.twimg.com/media/DmhSKL5U8AAjMkz.jpg'],6,19,55,[],[],https://twitter.com/Forbes/status/1038170050706976770,False,,1,https://pbs.twimg.com/media/DmhSKL5U8AAjMkz.jpg,,,,,,,[],,,,
1029846447427084291,1029846447427084291,2018-08-15 16:45:01 Hora de verano central (México),2018-08-15,16:45:01,-0500,91478624,forbes,Forbes,,Why you should own Bitcoin and other cryptocurrencies:  https://t.co/36Lf7vx6at  https://t.co/xwoLRgF2GL,en,[],['http://on.forbes.com/6016DvuSq'],['https://pbs.twimg.com/media/Dkq_4rzXcAAKML_.jpg'],3,51,132,[],[],https://twitter.com/Forbes/status/1029846447427084291,False,,1,https://pbs.twimg.com/media/Dkq_4rzXcAAKML_.jpg,,,,,,,[],,,,
