id,conversation_id,created_at,date,time,timezone,user_id,username,name,place,tweet,language,mentions,urls,photos,replies_count,retweets_count,likes_count,hashtags,cashtags,link,retweet,quote_url,video,thumbnail,near,geo,source,user_rt_id,user_rt,retweet_id,reply_to,retweet_date,translate,trans_src,trans_dest
1384305215537520644,1384305215537520644,2021-04-19 19:37:37 Hora de verano central (México),2021-04-19,19:37:37,-0500,39975533,vanguardngrnews,Vanguard Newspapers,,Remittance: ABCON advocates measures to counter cryptocurrencies  https://t.co/ivpnTVVgjl #vanguardnews  https://t.co/JxdwYKIMhj,en,[],['https://www.vanguardngr.com/2021/04/remittance-abcon-advocates-measures-to-counter-cryptocurrencies/?utm_source=dlvr.it&utm_medium=twitter'],['https://pbs.twimg.com/media/EzYKQeSUUAYQCgZ.jpg'],3,0,31,['vanguardnews'],[],https://twitter.com/vanguardngrnews/status/1384305215537520644,False,,1,https://pbs.twimg.com/media/EzYKQeSUUAYQCgZ.jpg,,,,,,,[],,,,
1384299802880401420,1384299802880401420,2021-04-19 19:16:06 Hora de verano central (México),2021-04-19,19:16:06,-0500,39975533,vanguardngrnews,Vanguard Newspapers,,Remittance: ABCON advocates measures to counter cryptocurrencies  https://t.co/MyPzxTbuBx,en,[],['https://www.vanguardngr.com/2021/04/remittance-abcon-advocates-measures-to-counter-cryptocurrencies/'],[],0,2,26,[],[],https://twitter.com/vanguardngrnews/status/1384299802880401420,False,,0,,,,,,,,[],,,,
1383223698254024705,1383223698254024705,2021-04-16 20:00:03 Hora de verano central (México),2021-04-16,20:00:03,-0500,39975533,vanguardngrnews,Vanguard Newspapers,,"Turkey bans payment with cryptocurrencies, citing transaction risks  https://t.co/rrCoT9T5kU #vanguardnews  https://t.co/eLzOnswqIM",en,[],['https://www.vanguardngr.com/2021/04/turkey-bans-payment-with-cryptocurrencies-citing-transaction-risks/?utm_source=dlvr.it&utm_medium=twitter'],['https://pbs.twimg.com/media/EzIyn5CVoAAYy49.jpg'],1,5,21,['vanguardnews'],[],https://twitter.com/vanguardngrnews/status/1383223698254024705,False,,1,https://pbs.twimg.com/media/EzIyn5CVoAAYy49.jpg,,,,,,,[],,,,
1383215706007760898,1383215706007760898,2021-04-16 19:28:17 Hora de verano central (México),2021-04-16,19:28:17,-0500,39975533,vanguardngrnews,Vanguard Newspapers,,"Turkey bans payment with cryptocurrencies, citing transaction risks  https://t.co/3qgMEDNORb",en,[],['http://www.vanguardngr.com/2021/04/turkey-bans-payment-with-cryptocurrencies-citing-transaction-risks/'],[],0,12,19,[],[],https://twitter.com/vanguardngrnews/status/1383215706007760898,False,,0,,,,,,,,[],,,,
1383057232405831682,1383057232405831682,2021-04-16 08:58:34 Hora de verano central (México),2021-04-16,08:58:34,-0500,39975533,vanguardngrnews,Vanguard Newspapers,,Turkey bans payment with cryptocurrencies  https://t.co/atIR0GIivT #vanguardnews,en,[],['https://www.vanguardngr.com/2021/04/turkey-bans-payment-with-cryptocurrencies/?utm_source=dlvr.it&utm_medium=twitter'],[],3,4,21,['vanguardnews'],[],https://twitter.com/vanguardngrnews/status/1383057232405831682,False,,0,,,,,,,,[],,,,
1383054269280968705,1383054269280968705,2021-04-16 08:46:48 Hora de verano central (México),2021-04-16,08:46:48,-0500,39975533,vanguardngrnews,Vanguard Newspapers,,Turkey bans payment with cryptocurrencies  https://t.co/hnoI9n78T6,en,[],['https://www.vanguardngr.com/2021/04/turkey-bans-payment-with-cryptocurrencies/'],[],1,6,27,[],[],https://twitter.com/vanguardngrnews/status/1383054269280968705,False,,0,,,,,,,,[],,,,
1365303118142050305,1365303118142050305,2021-02-26 08:10:04 Hora estándar central (México),2021-02-26,08:10:04,-0500,39975533,vanguardngrnews,Vanguard Newspapers,,"""Cryptocurrencies in the coming years will challenge traditional banking, including reserve banking, in ways that we cannot yet imagine, so we need to be prepared for that seismic shift.""  —  VP Yemi Osinbajo. #CBNBankersVanguard",en,[],[],[],8,24,97,['cbnbankersvanguard'],[],https://twitter.com/vanguardngrnews/status/1365303118142050305,False,,0,,,,,,,,[],,,,
1358677207401459714,1358677207401459714,2021-02-08 01:21:03 Hora estándar central (México),2021-02-08,01:21:03,-0500,39975533,vanguardngrnews,Vanguard Newspapers,,"Cryptocurrencies unregulated, prone to financial crimes – CBN  https://t.co/ib8oh1ihFM #vanguardnews  https://t.co/ReQ53q33OJ",en,[],['https://www.vanguardngr.com/2021/02/cryptocurrencies-unregulated-prone-to-financial-crimes-cbn/?utm_source=dlvr.it&utm_medium=twitter'],['https://pbs.twimg.com/media/Etr9uEMVIAE4oBu.jpg'],6,6,24,['vanguardnews'],[],https://twitter.com/vanguardngrnews/status/1358677207401459714,False,,1,https://pbs.twimg.com/media/Etr9uEMVIAE4oBu.jpg,,,,,,,[],,,,
1358673023994322944,1358673023994322944,2021-02-08 01:04:26 Hora estándar central (México),2021-02-08,01:04:26,-0500,39975533,vanguardngrnews,Vanguard Newspapers,,"Cryptocurrencies unregulated, prone to financial crimes – CBN  https://t.co/m6kGVT52WO",en,[],['http://www.vanguardngr.com/2021/02/cryptocurrencies-unregulated-prone-to-financial-crimes-cbn/'],[],26,11,57,[],[],https://twitter.com/vanguardngrnews/status/1358673023994322944,False,,0,,,,,,,,[],,,,
1203229576924520448,1203229576924520448,2019-12-07 02:27:40 Hora estándar central (México),2019-12-07,02:27:40,-0500,39975533,vanguardngrnews,Vanguard Newspapers,,Bitcoin and Cryptocurrencies: More than just trading  https://t.co/KT939o1U3d #vanguardnews  https://t.co/9sWbus79Xu,en,[],['https://www.vanguardngr.com/2019/12/bitcoin-and-cryptocurrencies-more-than-just-trading/?utm_source=dlvr.it&utm_medium=twitter'],['https://pbs.twimg.com/media/ELK67GjUUAEu5eS.jpg'],0,2,6,['vanguardnews'],[],https://twitter.com/vanguardngrnews/status/1203229576924520448,False,,1,https://pbs.twimg.com/media/ELK67GjUUAEu5eS.jpg,,,,,,,[],,,,
1089939953377837056,1089939953377837056,2019-01-28 11:35:09 Hora estándar central (México),2019-01-28,11:35:09,-0500,39975533,vanguardngrnews,Vanguard Newspapers,,Nigerians invest more in Cryptocurrencies as prices crash --LUNO survey ===has been published on Vanguard News Nigeria -  https://t.co/4MPwMpdfN7  https://t.co/owCeC0WRy9,en,[],['https://www.vanguardngr.com/2019/01/nigerians-invest-more-in-cryptocurrencies-as-prices-crash-luno-survey/'],['https://pbs.twimg.com/media/DyA-nGIX0AAb4vS.jpg'],0,1,5,[],[],https://twitter.com/vanguardngrnews/status/1089939953377837056,False,,1,https://pbs.twimg.com/media/DyA-nGIX0AAb4vS.jpg,,,,,,,[],,,,
1032154672331726849,1032154672331726849,2018-08-22 01:37:05 Hora de verano central (México),2018-08-22,01:37:05,-0500,39975533,vanguardngrnews,Vanguard Newspapers,,Hackers target smartphones to mine cryptocurrencies===has been published on Vanguard News -  https://t.co/oPmRCXo06t  https://t.co/7ltqW70iCL,en,[],['https://www.vanguardngr.com/2018/08/hackers-target-smartphones-to-mine-cryptocurrencies/'],['https://pbs.twimg.com/media/DlLzNE8UwAAxYc-.jpg'],0,1,1,[],[],https://twitter.com/vanguardngrnews/status/1032154672331726849,False,,1,https://pbs.twimg.com/media/DlLzNE8UwAAxYc-.jpg,,,,,,,[],,,,
995985602662289409,995985602662289409,2018-05-14 06:14:06 Hora de verano central (México),2018-05-14,06:14:06,-0500,39975533,vanguardngrnews,Vanguard Newspapers,,Cryptocurrencies hit dead end===has been published on Vanguard News -  https://t.co/rFTwbLs2E7  https://t.co/7Hw3W6xzWn,en,[],['https://www.vanguardngr.com/2018/05/cryptocurrencies-hit-dead-end/'],['https://pbs.twimg.com/media/DdJzoIBVwAAeWq4.jpg'],2,3,1,[],[],https://twitter.com/vanguardngrnews/status/995985602662289409,False,,1,https://pbs.twimg.com/media/DdJzoIBVwAAeWq4.jpg,,,,,,,[],,,,
956761255171178502,956761255171178502,2018-01-25 23:30:33 Hora estándar central (México),2018-01-25,23:30:33,-0500,39975533,vanguardngrnews,Vanguard Newspapers,,"Investors in cryptocurrencies are gamblers — Emefiele - By Elizabeth Adegbesan Central Bank of Nigeria (CBN) yesterday said that it would render support to Nigerians investing in cryptocurrency, describing such investment has gambling. The Governor of...  https://t.co/gYQGaPmqGH",en,[],['http://ow.ly/w0c150gg5f4'],[],4,7,6,[],[],https://twitter.com/vanguardngrnews/status/956761255171178502,False,,0,,,,,,,,[],,,,
955477817717940229,955477817717940229,2018-01-22 10:30:38 Hora estándar central (México),2018-01-22,10:30:38,-0500,39975533,vanguardngrnews,Vanguard Newspapers,,"Largest Nordic bank Nordea bans employees’ bitcoin trade - Nordea, the Nordic region’s biggest bank, said Monday it would bar employees from trading in bitcoin and other cryptocurrencies as of February 28 due to the unregulated nature of the market. B...  https://t.co/9m79Yaxdj5",en,[],['http://ow.ly/LMfA50gda1J'],[],0,0,2,[],[],https://twitter.com/vanguardngrnews/status/955477817717940229,False,,0,,,,,,,,[],,,,
